"otsikko","teksti","tahdet","url","kieli"
"placeholder","Maistuu palaneelle keksille. Ei lähelläkään alkuperäistä keksisuklaata. TODELLA suuri pettymys! Ensimmäistä kertaa ikinä jäi levy syömättä. Maku on aivan kamala. Kehtaavatkin mainostaa tätä suosikki makuna.","1","https://fi.fazer.com/collections/all/products/karl-fazer-rouhea-keksi-suklaalevy-180-g-n","fi"
"placeholder","Elättelin jo toiveita että olisi ollut ylivoimaisesti paras maku keksicrisp uudella houkuttelevammalla nimellä ja pakkauksella. Ei ollut... Miellyttävä koostumus, mutta vähän mauton. Monta palaa saa syödä ennenkö saa kunnolla mausta kiinni, mutta sitten jo samantien tökkiikin. Keksicrisp takaisin!","3","https://fi.fazer.com/collections/all/products/karl-fazer-rouhea-keksi-suklaalevy-180-g-n","fi"
"placeholder","maistuu soijarouheelta, niin mauton ja tylsä. ei jatkoon:(","1","https://fi.fazer.com/collections/all/products/karl-fazer-rouhea-keksi-suklaalevy-180-g-n","fi"
"placeholder","Keksistä tulee ihanasti rouskuvaa rakennetta, mutta keksin makua saa hakea pitkään, ennen kuin se maistuu. Muuten maukas ja rouhea suklaa!","3","https://fi.fazer.com/collections/all/products/karl-fazer-rouhea-keksi-suklaalevy-180-g-n","fi"
"placeholder","En suosittele tätä suklaata. Hyvin mauton maku. Ainut hyvä asia on, ettei tule liikaa syötyä kun on niin kamalan makuista","1","https://fi.fazer.com/collections/all/products/karl-fazer-rouhea-keksi-suklaalevy-180-g-n","fi"
"placeholder","Siis mä oon odottanut Bisquit crispin paluuta niin monta vuotta koska paras fazerin levy mitä ikinä tehty 🩷 Ja mainostettiin että tekee paluun.... eikä todellakaan oo vielä näkyny... en sano että huono, mutta ei ole sama. Siksi suuri pettymys 😭😭😭","2","https://fi.fazer.com/collections/all/products/karl-fazer-rouhea-keksi-suklaalevy-180-g-n","fi"
"placeholder","Mauton suklaa. Kiva rakenne keksistä kuitenkin.","3","https://fi.fazer.com/collections/all/products/karl-fazer-rouhea-keksi-suklaalevy-180-g-n","fi"
"placeholder","Ihan ok, harmi vain kun ei ole yhtään niin hyvä kuin edellinen keksisuklaa. Keksicrisp oli 5* arvoinen.","3","https://fi.fazer.com/collections/all/products/karl-fazer-rouhea-keksi-suklaalevy-180-g-n","fi"
"placeholder","Mielestäni aika tylsä makuelämys. Suussa maistuu vain rouhea keksi ja suklaan maku jää sivuun. Vähän pettymys. En osta uudelleen.","1","https://fi.fazer.com/collections/all/products/karl-fazer-rouhea-keksi-suklaalevy-180-g-n","fi"
"placeholder","Tykkään rakenteesta, keksinpalat rouskuu mukavasti suussa ja niitä on hyvin. Mutta jotenkin tämä itse suklaa on mautonta, johtunee tuosta palmuöljystä. Miksi fazer pilaatte suklaanne tällä kamaluudella? Ottakaa se palmuöljy nyt jo pois niin alkaa suklaatki maistumaan! Vaikka kuinka koitan imeskellä suussa tätä suklaata niin en vaan saa makua irti tarpeeksi.. Kiitos fazer, kiitos palmuöljy! Tätä keksisuklaata ootettu ku kuuta nousevaa ja sitten se pilattiin palmuöljyllä. Huoh.","2","https://fi.fazer.com/collections/all/products/karl-fazer-rouhea-keksi-suklaalevy-180-g-n","fi"
"placeholder","Ikävää, että mainostettiin suosikkimaun palanneen, kun kyseessä aivan eri tuote. Itse olin todella innostunut, kun näin kyseisen MyFazer äänestyksen ja keksi crispin lopulta voitettua jäin odottamaan kaikkien aikojen suosikkisuklaani paluuta. Pettymys oli todella suuri, kun suklaa ei ollut sitä samaa mitä aikaisemmin. Ymmärrän jos tuotteiden reseptiikkaa muutetaan, mutta ei tarvitsisi mainostaa virheellisesti. Ei kyseessä ole mikään paluu, vaan täysin uusi tuote. Suuri pettymys vuosien odotuksen jälkeen.","2","https://fi.fazer.com/collections/all/products/karl-fazer-rouhea-keksi-suklaalevy-180-g-n","fi"
"placeholder","Odotukset oli, että maistuisi samalta kuin keksi crisp suklaa aikoinaan, mitä on toivottu paljon takaisin. Maku jäi kuitenkin aika laimeaksi ja mitään sanomattomaksi. Suklaa on ihan hyvää, mutta ei vastannut ollenkaan odotuksia.","3","https://fi.fazer.com/collections/all/products/karl-fazer-rouhea-keksi-suklaalevy-180-g-n","fi"
