otsikko,teksti,tahdet,url,kieli
placeholder,"Ihan ok kapistus, tosin ohjeessa mainittiin merkkiääni veden saavuttaessa pyydetyt asteet, tämä laite ei ?????",4,https://hobbyhall.fi/fi/review/593/593#review-10,fi
placeholder,"Kivat nuo väriä vaihtavat ledit. On kauniin näköinen ja toimii kuten pitää. Ainut miinus, että veden keittäminen kestää aika kauan.",4,https://hobbyhall.fi/fi/review/593/593#review-10,fi
placeholder,Nopea ja kaunis keitin!♥️ Kattila ja paistinpannu,5,https://hobbyhall.fi/fi/review/593/593#review-10,fi
placeholder,"Tarvitsin vedenkeittimen, jossa voi säätää lämpötilaa – tärkeää vihreää teetä varten. Vedenkeitin lämmittää veden nopeasti. Olen erittäin tyytyväinen.",5,https://hobbyhall.fi/fi/review/593/593#review-10,fi
placeholder,"Onnistunut muotoilu, hinta laatu suhde hyvä!",4,https://hobbyhall.fi/fi/review/593/593#review-10,fi
placeholder,Kaikki toimii hyvin tilaaminen ja maksaminen,5,https://hobbyhall.fi/fi/review/593/593#review-10,fi
placeholder,Hyvän näköinen ja tuotteen kuvaa vastaava.,4,https://hobbyhall.fi/fi/review/593/593#review-10,fi
placeholder,"Erinomainen hinta/laatusuhde. Käytössä päivittäin, olen tyytyväinen ostokseeni.",5,https://hobbyhall.fi/fi/review/593/593#review-10,fi
placeholder,Edullinen mutta laadukas vedenkeitin. Lämpötilaa voi säätää. Sopii hyvin erilaisten tee juomien harrastajille.,5,https://hobbyhall.fi/fi/review/593/593#review-10,fi
placeholder,Mukava ja kaunis malli,5,https://hobbyhall.fi/fi/review/593/593#review-10,fi
placeholder,Tuote on todella hyvä ja tyylikäs,5,https://hobbyhall.fi/fi/review/593/593#review-10,fi
placeholder,"muuten hyvä mutta painava, ei sovi jos käsivoimat ovat alentuneet",5,https://hobbyhall.fi/fi/review/593/593#review-10,fi
placeholder,"Edullinen, laadukas ja eri lämpötiloihin pysähtyvä toiminto tekee tuotteesta 5/5",5,https://hobbyhall.fi/fi/review/593/593#review-10,fi
placeholder,Tuote on hyväksi havaittu jo aiemmin. Hinta oli sopiva.,5,https://hobbyhall.fi/fi/review/33473/48508#review-10,fi
placeholder,Tämän kokoiseen pakkaukseen kuuluisi edes jonkinlainen kantokahva.,3,https://hobbyhall.fi/fi/review/33473/48508#review-10,fi
placeholder,"Loistava vaihtoehto normaaleille kissanhiekoille. Riittoisa, tehokas hajujen pitäjä ja kaikista tärkeintä se, että kissat tykkää.",5,https://hobbyhall.fi/fi/review/33473/48508#review-10,fi
placeholder,Helppo siivota ja todella pehmeä,5,https://hobbyhall.fi/fi/review/33473/48508#review-10,fi
placeholder,Helppo siivota ja todella pehmeä,5,https://hobbyhall.fi/fi/review/33473/48508#review-10,fi
placeholder,Helppo siivota ja todella pehmeä,5,https://hobbyhall.fi/fi/review/33473/48508#review-10,fi
placeholder,Meidän kissat tykkää tästä luonnon sahanpuru kissanhiekasta. Nopeasti paakuuntuva!,5,https://hobbyhall.fi/fi/review/33473/48508#review-10,fi
placeholder,Hiekkaa iso helppo.,4,https://hobbyhall.fi/fi/review/33473/48508#review-10,fi
placeholder,Kaikki sujui hyvin. Tuote oli toimitettu hyvin etuajassa.,5,https://hobbyhall.fi/fi/review/33473/48508#review-10,fi
placeholder,Pussi oli auki kulmasta kun ei oltu pakattu mitenkään,5,https://hobbyhall.fi/fi/review/33473/48508#review-10,fi
placeholder,"+ Edullinen + Tiiviit paakut - Pölyävä, ei astmaatikoille - Hajuja ei pidä hyvin poissa - Lyhyt vaihtoväli",3,https://hobbyhall.fi/fi/review/33473/48508#review-10,fi
placeholder,Säkit on rikkinäisiä,3,https://hobbyhall.fi/fi/review/33473/48508#review-10,fi
placeholder,"Tuotettu ei paketoitu, mutta ei ollut menny rikki.",5,https://hobbyhall.fi/fi/review/33473/48508#review-10,fi
placeholder,Ei voi arvostella pakkaamista kun säkit tuli pakkaamatta. Onneksi ei ollu rikki. Huipputuote muuten!,5,https://hobbyhall.fi/fi/review/33473/48508#review-10,fi
placeholder,Paras Kissanhieka ikinä,5,https://hobbyhall.fi/fi/review/33473/48508#review-10,fi
placeholder,"Paras kissanhiekka, edullisin täältä ostettaessa, ekologinen, riittoisa.",5,https://hobbyhall.fi/fi/review/33473/48508#review-10,fi
placeholder,"Useasti olen ostanut, kissa tykkää siitä.",5,https://hobbyhall.fi/fi/review/33473/48508#review-10,fi
placeholder,"Cat's Best paakkuuntuva kissanhiekka on ehdottomasti parasta mitä markkinoilta saa, sitoo hajut hyvin ja voi kompostoida. Kallista mutta hyvää!",5,https://hobbyhall.fi/fi/review/33473/48508#review-10,fi
placeholder,Kissa on käyttänyt tätä hiekka 15 vuotta,5,https://hobbyhall.fi/fi/review/33473/48508#review-10,fi
placeholder,Olin tosi pettynyt kun tuotetta ei oltu pakattu lainkaan. Säkki tuli sellaisenaan ja toisessa säkissä oli reikä mistä valui ulos purua. Sain vajaan pussin. Olin todella pettynyt.,5,https://hobbyhall.fi/fi/review/33473/48508#review-10,fi
placeholder,"Edullinen, riittoisa, ekologinen, helppo, ei haise lainkaan. Ylivoimaisesti paras kissanhiekka, vaikkei nyt teknisesti hiekka olekaan.",5,https://hobbyhall.fi/fi/review/33473/48508#review-10,fi
placeholder,Liian kauan noutopiste.,5,https://hobbyhall.fi/fi/review/33473/48508#review-10,fi
placeholder,"Riittoisaa ja kissa tykkää käyttää, mutta jää helposti tassuihin kiinni ja murusia leviää jonkin verran muuallekin.",4,https://hobbyhall.fi/fi/review/33473/48508#review-10,fi
placeholder,"Hyvä tuote, kilpailukykyinen hinta, noudin pussin liikkeestä, nopeasti tuli sinne haettavaksi.",5,https://hobbyhall.fi/fi/review/33473/48508#review-10,fi
placeholder,"Muuten hyvä, mutta ei se tuote joka kuvassa.",3,https://hobbyhall.fi/fi/review/33473/48508#review-10,fi
placeholder,Tykkään käyttää tätä tuotetta kissoilleni. Tämä tuote tuntuu kissoistakin hyvälle ja paakkuuntuu mukavasti. Hyvä puhdistaa pissapaakkuja.,5,https://hobbyhall.fi/fi/review/33473/48508#review-10,fi
placeholder,Toimitus ja helppous tilauksessa,5,https://hobbyhall.fi/fi/review/33473/48508#review-10,fi
placeholder,Tuttu tuote ja hinta sopiva. Toimitus nopea.,5,https://hobbyhall.fi/fi/review/33473/48508#review-10,fi
placeholder,Olen käyttän tätä hiekka kissalleni 11 vuotta. Voidaan heittää wc:hen tai kompostiin. Ympäristövällinen. Neuvon.,5,https://hobbyhall.fi/fi/review/33473/48508#review-10,fi
placeholder,"Hyvin kaakkuuntuva, biohajoava ja pitää hajut poissa.",5,https://hobbyhall.fi/fi/review/33473/48508#review-10,fi
placeholder,"Nopea Toimitus. Hieman hirvitti kun pussia ei oltu milläänlailla suojattu, oli kumminkin paperipussi.",5,https://hobbyhall.fi/fi/review/33473/48508#review-10,fi
placeholder,"Loistava tuote, ei hajuja",5,https://hobbyhall.fi/fi/review/33473/48508#review-10,fi
placeholder,En ole saanut kuin toisen tilaamani säkin. Ettekä ole paluttanut edes paluttanut maksuani kortilleni.,5,https://hobbyhall.fi/fi/review/33473/48508#review-10,fi
placeholder,Suosittelen kaikille joilla on kissa.,5,https://hobbyhall.fi/fi/review/33473/48508#review-10,fi
placeholder,Hyvä kissanhiekkaa,4,https://hobbyhall.fi/fi/review/33473/48508#review-10,fi
placeholder,"Kyllä hekka hyvää, mutta kuuluutus varmasti isompi, kun taballiseltä puupohjaisia hekkaa",4,https://hobbyhall.fi/fi/review/33473/48508#review-10,fi
placeholder,"Toimivan oloinen ja järkihintainen saha pienten halkojen, lautojen tms sauna puiden pätkimiseen. Kaksi akkua antaa lisää sahausaikaa.",4,https://hobbyhall.fi/fi/review/116003/203423#review-10,fi
placeholder,"Olin Oikein Ihmeissäni Akkujen Kestävyydestä & Ei Pidä Meteliä & Ei Enään Sähköjohtoa Jaloissa Pyörimässsä !!! Täydellinen Ostos & Tiätysti Makita On Paras Merkki , NIINKUIN KAIKKI AKKU TYÖKONEENI ON MELKI KAIKKI MAKITAA !!!",5,https://hobbyhall.fi/fi/review/116003/203423#review-10,fi
placeholder,Hyvä toimiva laite,5,https://hobbyhall.fi/fi/review/116003/203423#review-10,fi
placeholder,"Muuten hyvä, mutta ketjusuojuksen irrottaminen on hieman haastavaa.",4,https://hobbyhall.fi/fi/review/116003/203423#review-10,fi
placeholder,Nopea ja lupauksen mukainen toimitus.,5,https://hobbyhall.fi/fi/review/116003/203423#review-10,fi
placeholder,Toimiva laatu tuote edullisesti.,5,https://hobbyhall.fi/fi/review/116003/203423#review-10,fi
placeholder,Erittäin hyvä rakennus ja risuihin. 2 akulla jaksaa,4,https://hobbyhall.fi/fi/review/116003/203423#review-10,fi
placeholder,"Hyvin toimiva kone, Tyytyväinen ostokseen.",5,https://hobbyhall.fi/fi/review/116003/203423#review-10,fi
placeholder,"Laatusaha ja juurikin 2.lla akulla ,niin ei jää homma kesken. Mukavan kevyt ja tehokas.",5,https://hobbyhall.fi/fi/review/116003/203423#review-10,fi
placeholder,saha vaikuttaa ihan asialliselta.,4,https://hobbyhall.fi/fi/review/116003/203423#review-10,fi
placeholder,Hyvin on toiminut pienten puiden sahaamisessa,4,https://hobbyhall.fi/fi/review/116003/203423#review-10,fi
placeholder,Erittäin toimiva laite,5,https://hobbyhall.fi/fi/review/116003/203423#review-10,fi
placeholder,"Toimitusajan informaatiossa sähellystä, muuten kaikki hyvin.",4,https://hobbyhall.fi/fi/review/116003/203423#review-10,fi
placeholder,Hyvä saha ja hyvä akun kesto!,5,https://hobbyhall.fi/fi/review/116003/203423#review-10,fi
placeholder,Nopea toimitus ja saha toimii kuten pitääkin!,5,https://hobbyhall.fi/fi/review/116003/203423#review-10,fi
placeholder,Hyvää see on. Kiitan!,5,https://hobbyhall.fi/fi/review/116003/203423#review-10,fi
placeholder,Toimii kuten pitääkin.,5,https://hobbyhall.fi/fi/review/116003/203423#review-10,fi
placeholder,Erittäin vahva saha mökki käyttöön!,5,https://hobbyhall.fi/fi/review/116003/203423#review-10,fi
placeholder,ihan ok kotikäytössä voittaa konesahan,4,https://hobbyhall.fi/fi/review/116003/203423#review-10,fi
placeholder,Hyvä tuote ja tuli ajallaan,4,https://hobbyhall.fi/fi/review/116003/203423#review-10,fi
placeholder,"hintaisekseen yllättävän hyvä, ainoa ongelma on että jos painaa vähänkään kovempaa niin teho loppuu kesken ja veto loppuu. Toimii yhtä hyvin kuin joku 700 euron husqvarna polttomoottorisaha, vain 30% hitaammin per paksun puun katkaisu. Ranteen paksusen ja ohuemma karsintahommissa saattaa olla jopa nopeampi, koska menee käytännössä välittömästi ""tyhjäkäynnistä"" leikkuunopeuteen. Ergonomiansa puolesta paljon parempi koska on yli kilon kevyempi.",4,https://hobbyhall.fi/fi/review/116003/203423#review-10,fi
placeholder,Tuote on sitä mitä pitikin,4,https://hobbyhall.fi/fi/review/116003/203423#review-10,fi
placeholder,"Hyvä, kätevä ja hinnaltaan edullinen. Nopea toimitus.",5,https://hobbyhall.fi/fi/review/116003/203423#review-10,fi
placeholder,"Lyhyen testailun jälkeen juuri sellainen kuin odotinkin. Pienehköihin kodin puuhommiin (rakennus, polttopuut yms.) oikein mainio peli.",5,https://hobbyhall.fi/fi/review/116003/203423#review-10,fi
placeholder,"Hyvä akku Saha, ja hyvä palvelu",4,https://hobbyhall.fi/fi/review/116003/203423#review-10,fi
placeholder,muuten hyvä imuri minun tarpeeseen mutta akku sais olla kestävämpi,4,https://hobbyhall.fi/fi/review/2236293/2676373#review-10,fi
placeholder,"Loistava pikkuapulainen sekä tehokas apuri, pärjää ilman varsinaista imuria, jos ei ole eläimiä.",4,https://hobbyhall.fi/fi/review/2236293/2676373#review-10,fi
placeholder,Ihana ja helpoo nopeiasti siivota minä rakastan,4,https://hobbyhall.fi/fi/review/2236293/2676373#review-10,fi
placeholder,Pari päivän jälkeen niin ei toimi hyviin se pieni imuri lähtee sieltä nappi ei toimi,1,https://hobbyhall.fi/fi/review/2236293/2676373#review-10,fi
placeholder,Kätevä pieneen imurointiin.,5,https://hobbyhall.fi/fi/review/2236293/2676373#review-10,fi
placeholder,Näppärä hyvä käyttää,5,https://hobbyhall.fi/fi/review/2236293/2676373#review-10,fi
placeholder,Sujuvat ja nopeat kaupat.,5,https://hobbyhall.fi/fi/review/2236293/2676373#review-10,fi
placeholder,"Imurointi on, jotenkin niin vaivatonta ja helppoa, varsi imurilla.. Helppo ladata,, ei ole johto tiellä.. Olen tosi tyytyväinen, että ostin tämän tuotteen..",5,https://hobbyhall.fi/fi/review/2236293/2676373#review-10,fi
placeholder,Nopea toimitus..,5,https://hobbyhall.fi/fi/review/2236293/2676373#review-10,fi
placeholder,"On kevyt, sopii myös iäkkäälle",4,https://hobbyhall.fi/fi/review/2236293/2676373#review-10,fi
placeholder,"Toimii hyvin , hyvä teho.",5,https://hobbyhall.fi/fi/review/2236293/2676373#review-10,fi
placeholder,Olen ihan tyytyväinen,5,https://hobbyhall.fi/fi/review/2236293/2676373#review-10,fi
placeholder,toistaiseksi kaikki toimii hyvin,4,https://hobbyhall.fi/fi/review/2236293/2676373#review-10,fi
placeholder,"Monenlaisia imureita on ollut ,tämä on ehdottomasti paras",5,https://hobbyhall.fi/fi/review/2236293/2676373#review-10,fi
placeholder,"se meni rikki 3 kk:n jälkeen, oli takuussa, mutta myymälä ei korjannut sitä, kutsui sitä ""takuun ulkopuoliseksi tapaukseksi"", vaikka niiden piti kattaa pölynimurin korjaus. En suosittele tätä pölynimuria ja kauppaa yleensä",1,https://hobbyhall.fi/fi/review/2236293/2676373#review-10,fi
placeholder,Imee hyvin roskat ja pölyn. Hiljainen ääni. Hyvä muotoilu. Pirteä väri. Hinta /laatusuhde mainio. Oli tuote puoleen hintaan. Akun kesto selviää myöhemmin.,5,https://hobbyhall.fi/fi/review/2236293/2676373#review-10,fi
placeholder,Erittäin tehokas,5,https://hobbyhall.fi/fi/review/2236293/2676373#review-10,fi
placeholder,Varsi-imureissa yleensä pieni pölysäiliö. Muutoin laadukas tuote.,4,https://hobbyhall.fi/fi/review/2236293/2676373#review-10,fi
placeholder,"Hyvä, täytti odotukser",5,https://hobbyhall.fi/fi/review/2236293/2676373#review-10,fi
placeholder,"Pieneen kämppään sopiva varsi-imuri. Kätevä rikkaimuri. Käyttöaika vähän lyhyt, mutta pieneen kämppään riittävä.",4,https://hobbyhall.fi/fi/review/2236293/2676373#review-10,fi
placeholder,Toimiva varsi-imuri pikaiseen imurointiin.,4,https://hobbyhall.fi/fi/review/2236293/2676373#review-10,fi
placeholder,Olen ollut tyyytyväinen tilaamiini tuotteisiin,5,https://hobbyhall.fi/fi/review/2236293/2676373#review-10,fi
placeholder,Kerran kokeillut. Hyvin tuntuu toimivan.,5,https://hobbyhall.fi/fi/review/2236293/2676373#review-10,fi
placeholder,Boch hyvä merkki. Menee joululahjaksi mutta varmasti myös toimii.,5,https://hobbyhall.fi/fi/review/2236293/2676373#review-10,fi
placeholder,Akun kestävyys ei ihan huippu luokkaa,4,https://hobbyhall.fi/fi/review/2236293/2676373#review-10,fi
placeholder,Ihan ok vehje hintaansa nähden,3,https://hobbyhall.fi/fi/review/2236293/2676373#review-10,fi
placeholder,Tuote on vasta tullut käyttöön mutta ensivaikutelma lupaa hyvää ja pitkää käyttöä.,5,https://hobbyhall.fi/fi/review/2236293/2676373#review-10,fi
placeholder,Hyvä toimiva laite! Suosittelen.,5,https://hobbyhall.fi/fi/review/2236293/2676373#review-10,fi
placeholder,"Erinomainen ja kätevä tuote, lisäksi hyvän näköinen. Olen ollut hyvin tyytyväinen.",5,https://hobbyhall.fi/fi/review/4412431/5433581#review-10,fi
placeholder,Todella kätevä ja ihana!,5,https://hobbyhall.fi/fi/review/4412431/5433581#review-10,fi
placeholder,"Nopea toimitus, helppo kasata ja todella kätevä.",5,https://hobbyhall.fi/fi/review/4412431/5433581#review-10,fi
placeholder,Erittäin hyvä ja toimiva.,5,https://hobbyhall.fi/fi/review/4412431/5433581#review-10,fi
placeholder,"Hyvännäköinen ja käytännöllinen taso. Me säilytetään siinä pyykkiä. Huono puoli se, että yksi korin kannakkeista hajosi alle viikossa. Tietenkin tuotteen voi vaihtaa, kun se meni niin nopeasti rikki.",3,https://hobbyhall.fi/fi/review/4412431/5433581#review-10,fi
placeholder,"Lupausta nopeampi toimitus, helppo koota ja tarpeeseeni juuri oikea. Tarjoushinnan arvoinen (45€), normihinnan arvoinen (199€) ei.",5,https://hobbyhall.fi/fi/review/4412431/5433581#review-10,fi
placeholder,Juuri sopiva ja helppo koota.,5,https://hobbyhall.fi/fi/review/4412431/5433581#review-10,fi
placeholder,Erinomainen tuote ja oli helppo koota.,5,https://hobbyhall.fi/fi/review/4412431/5433581#review-10,fi
placeholder,"Kestävä ja siistin näköinen. Meillä makuuhuoneessa, josta helppo kantaa pyykit pesuhuoneeseen. Toimii meillä!",4,https://hobbyhall.fi/fi/review/4412431/5433581#review-10,fi
placeholder,"Meillä käytössä muovi/kartonki lajittelussa. Siisti ja näppärän kokoinen, pienen kodin eteisessä ei vie tilaa.",5,https://hobbyhall.fi/fi/review/4412431/5433581#review-10,fi
placeholder,"tosi kätevä moneen säilytykseen, itse säilytän likapyykkiä siinä. kaunis katsella ja komia.",5,https://hobbyhall.fi/fi/review/4412431/5433581#review-10,fi
placeholder,"Tyylikäs, helppo koota ja tarpeeksi tukeva. Ainut pieni miinus se että koreille ei ole stopperia, eli helppo vetää vahingossa kokonaan ulos.",5,https://hobbyhall.fi/fi/review/4412431/5433581#review-10,fi
placeholder,Helppo koota ja on juuri sitä mitä odotin.,5,https://hobbyhall.fi/fi/review/4412431/5433581#review-10,fi
placeholder,Siisti ja käytännöllinen,5,https://hobbyhall.fi/fi/review/4412431/5433581#review-10,fi
placeholder,Mielestäni hyvän näköinen,5,https://hobbyhall.fi/fi/review/4412431/5433581#review-10,fi
placeholder,Hyvä tuote hieno sopi pesuhuonesen,5,https://hobbyhall.fi/fi/review/4412431/5433581#review-10,fi
placeholder,"Hyvä tuote,nopea toimitus",5,https://hobbyhall.fi/fi/review/4412431/5433581#review-10,fi
placeholder,Helppo kasata. Just sellainen kun kuvassa.,5,https://hobbyhall.fi/fi/review/4412431/5433581#review-10,fi
placeholder,Hieno ja kaunis ja näppärä,5,https://hobbyhall.fi/fi/review/4412431/5433581#review-10,fi
placeholder,"Loistava sivupöytä/pyykkikoriratkaisu, nätti ja käytännöllinen pienessä tilassa.",5,https://hobbyhall.fi/fi/review/4412431/5433581#review-10,fi
placeholder,Todella hyvä ja niinkuin kuvauksessa luki. Helppo kasata yksin.,5,https://hobbyhall.fi/fi/review/4412431/5433581#review-10,fi
placeholder,"Ei ole vielä käytössä ollut pitkään, mutta tykkään, ainut miinus että jalkojen säätövara on tosi pieni.",4,https://hobbyhall.fi/fi/review/4412431/5433581#review-10,fi
placeholder,Kuvan mukainen tuote. Näppärä käytössä.,5,https://hobbyhall.fi/fi/review/4412431/5433581#review-10,fi
placeholder,"Tuote oli niinkuin pitikin, toimitus oli vaan käsittämättömän hidas.",5,https://hobbyhall.fi/fi/review/4412431/5433581#review-10,fi
placeholder,Tämä oli jotain ihan muuta kuin k18 hoito. Joku rasva laitettu k18 purkkiin.,1,https://hobbyhall.fi/fi/review/2981373/3612223#review-10,fi
placeholder,Tuote lhyvä. Hidas toimitus miinuksena,5,https://hobbyhall.fi/fi/review/2981373/3612223#review-10,fi
placeholder,Kaikki sujui tosi hyvin.,5,https://hobbyhall.fi/fi/review/2981373/3612223#review-10,fi
placeholder,Erinomainen tuote hiuksille.,5,https://hobbyhall.fi/fi/review/2981373/3612223#review-10,fi
placeholder,"Tuotetta on laitettava tosi vähän, tai tekee hiukset raskaiksi. On riittoisa ja korjaa hyvin hiuksia.",4,https://hobbyhall.fi/fi/review/2981373/3612223#review-10,fi
placeholder,Taattua laatua K18,5,https://hobbyhall.fi/fi/review/2981373/3612223#review-10,fi
placeholder,"Hyvä hoitoaine, käytän pari kertaa kuussa kun hiukset kaipaavat enemmän hoitoa.",4,https://hobbyhall.fi/fi/review/2981373/3612223#review-10,fi
placeholder,Tuote on juuri sellainen kuin halusin.,5,https://hobbyhall.fi/fi/review/2981373/3612223#review-10,fi
placeholder,"Vastaanotin tuotteen K18 Hiusnaamio, 50 ml, käytin sitä vain muutaman kerran ja huomasin että hiukseni menivät todella keltaisen väriseksi, taittoivat jopa vihreään. Otin yhteyttä HobbyHalliin ja kysyin onko mahdollista että tuotteen päiväys on mennyt umpeen tai voiko tuotteessa olla mahdollisesti muuta vikaa. Ilmoitin myös että en oikein uskaltaisi jatkaa tuotteen käyttöä, jos tämä johtuu tuotteen viallisuudesta. Kysyin onko mahdollista saada tietoa tuotteen alkuperäisestä hankintapaikasta, mutta tähän en ikinä ole saanut vastausta mikä vaikuttaa oudolta. En siis enää halua tilata HobbyHallista vaikka aiemmin olen tilannut useita kertoja, palautteeni käsittely jäi aivan kesken enkä saanut vastausta voiko tuotetta minulle hyvittää, kerran se oli kallis enkä ole sitä käyttänyt kuin pari kertaa.",1,https://hobbyhall.fi/fi/review/2981373/3612223#review-10,fi
placeholder,Ensikokemukset tuotteesta ovat hyvät. Tuotetta on helppo käyttää.,5,https://hobbyhall.fi/fi/review/2981373/3612223#review-10,fi
placeholder,Hyvä tuote ja helposti sain noudettua Tammistosta.,5,https://hobbyhall.fi/fi/review/2981373/3612223#review-10,fi
placeholder,Loistava hoitotuote hiuksille,5,https://hobbyhall.fi/fi/review/2981373/3612223#review-10,fi
placeholder,"Tekee sen minkä lupaa, loistava tuote!",5,https://hobbyhall.fi/fi/review/2981373/3612223#review-10,fi
placeholder,"Toimii, vaikka hiukan löysemmältä tuntuu kuin pikku tuubissa oleva aine. Toinen tilaamani purkki tätä.",5,https://hobbyhall.fi/fi/review/2981373/3612223#review-10,fi
placeholder,Nopea toimitus,5,https://hobbyhall.fi/fi/review/2981373/3612223#review-10,fi
placeholder,"Edullisin 50ml tuote jonka löysin. Toimii erinomaisesti, ylitti odotukset ja pelasti kemiallisesti ylikäsitellyt (useita vaalennuksia ja permanentti) täysin kuivuneet ja kärsineet hiukset.",5,https://hobbyhall.fi/fi/review/2981373/3612223#review-10,fi
placeholder,Paras hiusnaamio mitä löytyy,5,https://hobbyhall.fi/fi/review/2981373/3612223#review-10,fi
placeholder,"Ei ollut kuvan mukainen, mutta kelpaa",3,https://hobbyhall.fi/fi/review/2981373/3612223#review-10,fi
placeholder,"Tuote juuri sellainen kuin odotin, olen tilannut useamman kerran ja toimitus on todella nopea",5,https://hobbyhall.fi/fi/review/2981373/3612223#review-10,fi
placeholder,Lupauksen mukainen.,4,https://hobbyhall.fi/fi/review/2981373/3612223#review-10,fi
placeholder,Erittäin laadukas tuote.,5,https://hobbyhall.fi/fi/review/2981373/3612223#review-10,fi
placeholder,Hyvä tuttu tuote. Toiveena olisi vielä saada tuotteen loppuessa purkki auki viimeistenkin jäämien saamiseksi käyttöön.,5,https://hobbyhall.fi/fi/review/2981373/3612223#review-10,fi
placeholder,"Olen käyttänyt vasta 2 pesukertaa, tuote vaikuttaa erittäin riittoisalta.",5,https://hobbyhall.fi/fi/review/2981373/3612223#review-10,fi
placeholder,"Tuttu tuote, yleensä kampaajalta ostanut pienimmän. Tämä oli edullisin 50ml mitä löysin, useimmilla hinta 79e, hh alle 50e. Huipputuote käsitellyille hiuksille. Riittoisa, kannattaa aloittaa yhdellä painalluksella, eikä ohjeessa olevan 3 painalluksen mukaan. 4-6 käyttökerran jälkeen tarvittaessa. 4min vaikutusajan jälkeen kannattaa laittaa kosteuttavaa jätettävää hoitoainetta.",5,https://hobbyhall.fi/fi/review/2981373/3612223#review-10,fi
placeholder,"Loistotuote, vaikkakin hintava.",5,https://hobbyhall.fi/fi/review/2981373/3612223#review-10,fi
placeholder,Nyt muutaman kerran käyttänyt ja hiukset tuntuu heti paljon terveemmiltä!,5,https://hobbyhall.fi/fi/review/2981373/3612223#review-10,fi
placeholder,Erinomainen tuote!,5,https://hobbyhall.fi/fi/review/2981373/3612223#review-10,fi
placeholder,"Erittäin hyvä tuote. Tosi kallis, mutta hyvä.",5,https://hobbyhall.fi/fi/review/2981373/3612223#review-10,fi
placeholder,Erittäin hyvä hoitoaina,5,https://hobbyhall.fi/fi/review/2981373/3612223#review-10,fi
