otsikko,teksti,tahdet,url,kieli
placeholder,hyvä imuteho mut miinus koska liian kevyt kaatuu,5,https://hobbyhall.fi/fi/review/8923/13023#review-10,fi
placeholder,"Kätevän pieni mökille, mutta imuteho heikko. Ei jaksa imeä kiviä, kevyet roskat kyllä.",3,https://hobbyhall.fi/fi/review/8923/13023#review-10,fi
placeholder,Ei ole niin hyvää kun luulesin olevaan,1,https://hobbyhall.fi/fi/review/8923/13023#review-10,fi
placeholder,"No voihan hyssykät että olikin pieni imuri, siis tämä imuri sopii täydellisesti yksiöihin jotka ovat sopivan pieniä hänelle. Meilläkin 4hk joten aivan liian pieni.",3,https://hobbyhall.fi/fi/review/8923/13023#review-10,fi
placeholder,Pieni ja näppärä imuri pieniin talouksiin.,4,https://hobbyhall.fi/fi/review/8923/13023#review-10,fi
placeholder,Tottele on honno laatuun säylio irtto imurointi aikaan... Piuha lyhyt.... Imurointi lanttu honno.... Ja mellu tasso on järkyttävä....,1,https://hobbyhall.fi/fi/review/8923/13023#review-10,fi
placeholder,Toimii niinkuin tuotekuvaus kertoo!,5,https://hobbyhall.fi/fi/review/8923/13023#review-10,fi
placeholder,Ihan näppärä pieni imuri olin kyllä ensiksi et toimiikohan tämä edes? Toimihan se ihan kiitetysti ei ole ollut moittimisen varaa :),5,https://hobbyhall.fi/fi/review/8923/13023#review-10,fi
placeholder,Tosi tehokas ja kevyt imuri.,5,https://hobbyhall.fi/fi/review/8923/13023#review-10,fi
placeholder,Kiitos olet ystavalinr ja hyvää,5,https://hobbyhall.fi/fi/review/8923/13023#review-10,fi
placeholder,Monessa on vielä kehitelimistä,4,https://hobbyhall.fi/fi/review/8923/13023#review-10,fi
placeholder,Hintansa värtti erityisesti pienen asunnon imuirointiin,5,https://hobbyhall.fi/fi/review/8923/13023#review-10,fi
placeholder,Hyvä pikkuimuri.,5,https://hobbyhall.fi/fi/review/8923/13023#review-10,fi
placeholder,Ihan passeli pieneen asuntoon. Perus äänekäs imuri.,4,https://hobbyhall.fi/fi/review/8923/13023#review-10,fi
placeholder,"Luvattiin seuraavaksi päiväksi , meni kaksi . Asiakaspalvelu tukossa , kyseltyäni tuotetta kuli viikko kunnes vastaus tuli. Ei hyvä.",3,https://hobbyhall.fi/fi/review/8923/13023#review-10,fi
placeholder,"Hyvää,toimi hyvin",5,https://hobbyhall.fi/fi/review/8923/13023#review-10,fi
placeholder,"Olen tyytyväinen , toimitus oli myös nopea",5,https://hobbyhall.fi/fi/review/8923/13023#review-10,fi
placeholder,"Auton imurointiin tosi,tosi hyvä. Nopea ottaa ja kevyt",4,https://hobbyhall.fi/fi/review/8923/13023#review-10,fi
placeholder,Pieni ja tosi lyhyllä imuri putkella. Lähinnä lastensa käytön,1,https://hobbyhall.fi/fi/review/8923/13023#review-10,fi
placeholder,"Ihan lelu, halvan oloinen eli se Lelu",1,https://hobbyhall.fi/fi/review/8923/13023#review-10,fi
placeholder,"Tuitteet olleet vasta hetken käytössäni,joten arvostelu perustuu tähänastiseen",3,https://hobbyhall.fi/fi/review/8923/13023#review-10,fi
placeholder,Paljon pienempi kuin odotin. Plussaa pussittomuudesta ja helposta puhdistuksesta. Miinusta liian kovasta imutehosta ja säätömahdollisuuden puuttumisesta. Hyvä varaimuri.,3,https://hobbyhall.fi/fi/review/8923/13023#review-10,fi
placeholder,tuote sopii pinen asunnon siivoukseen,3,https://hobbyhall.fi/fi/review/8923/13023#review-10,fi
placeholder,"Pikku imuri yllättävän tehokas,auto imuri tai ilmalämpöpumpun puhdistukseen sopivan pieni. Pussiton ja sikäli kätevä.",5,https://hobbyhall.fi/fi/review/8923/13023#review-10,fi
placeholder,Kertakäyttötuote.,1,https://hobbyhall.fi/fi/review/8923/13023#review-10,fi
placeholder,Näppärä laite ei tarvi miettiä mistä ostaa pölyimurin suodatus pusseja. kun pussiton.,5,https://hobbyhall.fi/fi/review/8923/13023#review-10,fi
placeholder,Ei kovin hyvä imukyky.,2,https://hobbyhall.fi/fi/review/8923/13023#review-10,fi
placeholder,Oli juuri sellainen kuin esitteessä oli .,4,https://hobbyhall.fi/fi/review/8923/13023#review-10,fi
placeholder,"Hyvä toimituspalvelu, mutta tavarat eivät ole hyviä, en suosittele.",1,https://hobbyhall.fi/fi/review/8923/13023#review-10,fi
placeholder,Ei ollut tehokas.,1,https://hobbyhall.fi/fi/review/8923/13023#review-10,fi
placeholder,Yksiöön sopiva imuri. Ei paljon vielä käytetty joten aika näyttää miten kestää.,5,https://hobbyhall.fi/fi/review/8923/13023#review-10,fi
placeholder,Ihan ok imuri peruskäyttöön.,4,https://hobbyhall.fi/fi/review/8923/13023#review-10,fi
placeholder,Imuri ei ime kunnolla ja säiliötä pitää olla koko ajan tyhjentämässä. Johto liian lyhyt,1,https://hobbyhall.fi/fi/review/8923/13023#review-10,fi
placeholder,Halpa ja teholtaan heikko imuri.,1,https://hobbyhall.fi/fi/review/8923/13023#review-10,fi
placeholder,Tosi huonosti ei ole hyvä se on rikki,1,https://hobbyhall.fi/fi/review/8923/13023#review-10,fi
placeholder,"Siis ensinnäkin , täytän pian 38v ja olen usein erilaisia imuroitavissa käyttänyt... mutta tämä on pohjanoteeraus! Ikinä en ole yhtä huonolla imurilla imuroinut. Kauden kovaa meteliä pitää siihen nähden ettei edes ime kaikkia roskia. Ja vaikka kuinka naksahtaa kiinni osat niin koko ajan kesken imuroinnin saa olla taistelemassa että imuri pyyyy yhtenä kappaleena kun koko ajan irtoaa osat. Sen piti helpottaa arkeani mutta tekikin päinvastoin :( Asiakaspalvelu Hobbyhallissa on ollut miellyttävää. Ja lisäksi posti oli vaihtanut toimituspaikkaa joten täytyy linja-autolla vielä erikseen se hakea töiden jälkeen .",1,https://hobbyhall.fi/fi/review/8923/13023#review-10,fi
placeholder,"kätevän pieni ja kevyt käyttää, yllättävän tehokas",4,https://hobbyhall.fi/fi/review/8923/13023#review-10,fi
placeholder,Huippu imuri tähän hintaan! Paljon karvaa ja santaa keräävän rivari yksiön saa imuroida 5 kertaa ennenkuin täytyy tyhjentää ja hyvin lähtee koiran karvatkin matosta 5/5,5,https://hobbyhall.fi/fi/review/8923/13023#review-10,fi
placeholder,"Ihan ok imuri pieneen asuntoon, johto aika lyhyt.",4,https://hobbyhall.fi/fi/review/8923/13023#review-10,fi
placeholder,Minun huusholliin sopiva pikku imuri..,3,https://hobbyhall.fi/fi/review/8923/13023#review-10,fi
placeholder,"Tuote toiminut tähän päivään asti ainakin hyvin vaikka, lelulta tuntuukin.",4,https://hobbyhall.fi/fi/review/8923/13023#review-10,fi
placeholder,Hyvä imuri. Suositellaan,5,https://hobbyhall.fi/fi/review/8923/13023#review-10,fi
placeholder,Näppärä ja sopivan kokoinen,5,https://hobbyhall.fi/fi/review/8923/13023#review-10,fi
placeholder,On hyvä tehoilla ja on pitkä johto,4,https://hobbyhall.fi/fi/review/8923/13023#review-10,fi
placeholder,Mausteinen tuoksu syksyyn ja talveen,4,https://hobbyhall.fi/fi/review/340093/497648#review-10,fi
placeholder,Turhan pitkät toimitusajat,5,https://hobbyhall.fi/fi/review/340093/497648#review-10,fi
placeholder,Oma tuoksuni jo vuosia! En vaihda toisiin!!,5,https://hobbyhall.fi/fi/review/340093/497648#review-10,fi
placeholder,Nopea toimitus ja edullinen hinta,5,https://hobbyhall.fi/fi/review/340093/497648#review-10,fi
placeholder,Todella hyvä tuoksu ja riittoisa. Sopii arkeen ja juhlaan. Kaunis pullo. Tämä tuote on yksi lempi tuoksuistani.,5,https://hobbyhall.fi/fi/review/340093/497648#review-10,fi
placeholder,Nopea toimitus.Kiitos,5,https://hobbyhall.fi/fi/review/340093/497648#review-10,fi
placeholder,"Hyvä tarjous, erittäin nopea toimitus noutona",5,https://hobbyhall.fi/fi/review/340093/497648#review-10,fi
placeholder,"Ihana tuote, kiitos",5,https://hobbyhall.fi/fi/review/340093/497648#review-10,fi
placeholder,"Ihastuttava tuoksu, tuttu jo ennestään. Toimitus nopeaa, vain hyvää sanottavaa.",5,https://hobbyhall.fi/fi/review/340093/497648#review-10,fi
placeholder,iso pakkaus pienen hinnalla,5,https://hobbyhall.fi/fi/review/340093/497648#review-10,fi
placeholder,Ihan ok tuoksu tuttu tuoksu,5,https://hobbyhall.fi/fi/review/340093/497648#review-10,fi
placeholder,Ihana tuoksu etsin tätä kokoa ja löysin.,5,https://hobbyhall.fi/fi/review/340093/497648#review-10,fi
placeholder,Hyvä hajuvesi ihana tuoksu,5,https://hobbyhall.fi/fi/review/340093/497648#review-10,fi
placeholder,Nopea toimitus,5,https://hobbyhall.fi/fi/review/340093/497648#review-10,fi
placeholder,"Nopea, helppo ja hyvät tuotteet",5,https://hobbyhall.fi/fi/review/340093/497648#review-10,fi
placeholder,"Tuttu tuoksu, on hyvä.",4,https://hobbyhall.fi/fi/review/340093/497648#review-10,fi
placeholder,Olen tyytyväinen tuotteeseen. Oletin pullon olevan pienempi. Olen ostanut laivalta samaa tuotetta. Oli siellä kalliimpaa.,4,https://hobbyhall.fi/fi/review/340093/497648#review-10,fi
placeholder,Tuoksu on tuttu ja hyvöä. Asiakaspalvelu oli hyvää.,5,https://hobbyhall.fi/fi/review/340093/497648#review-10,fi
placeholder,Tuote oli pettymys. Muihin Escada tuotteisiin ja tuoksuihin tottuneena tämä oli ainoa joka ei vastannut odotuksia tuoksun puolesta. Pullo on kyllä kaunis mutta tuoksu on peruspuuterin hajuinen eikä yhtään hyvä kuten muut escadat.,2,https://hobbyhall.fi/fi/review/340093/497648#review-10,fi
placeholder,Kiitos kaikki sujui mukavasti.,4,https://hobbyhall.fi/fi/review/340093/497648#review-10,fi
placeholder,Kiitos kaikki sujui mukavasti.,4,https://hobbyhall.fi/fi/review/340093/497648#review-10,fi
placeholder,Nopea toimitus ja kätevästi lasku.,5,https://hobbyhall.fi/fi/review/340093/497648#review-10,fi
placeholder,Aikuiselle tyttärelle ostin lahjaksi. Kertoi pitävänsä tuoksusta ja käyttävänsä säännöllisesti. Naisellinen tuoksu.,5,https://hobbyhall.fi/fi/review/340093/497648#review-10,fi
placeholder,Tuoksun koko oli positiivinen yllätys!,5,https://hobbyhall.fi/fi/review/340093/497648#review-10,fi
placeholder,Tuttu tuote ja edullinen hinta,5,https://hobbyhall.fi/fi/review/340093/497648#review-10,fi
placeholder,Tykkäsin kovasti tuoksusta.,5,https://hobbyhall.fi/fi/review/340093/497648#review-10,fi
placeholder,Nopea toimitus ja toimiva tuote.,5,https://hobbyhall.fi/fi/review/2393/2973#review-10,fi
placeholder,"Retki-WC on menossa Ukrainaan, etulinjaan, joten en tiedä käyttökokemuksesta. Olisi kuitenkin hyvä jos HobbyHall myisi myös oheistarvikkeita, kuten jätepusseja, saostuaineita, puuseeturvetta tms. Mieluummin HobbyHallin omalla myynnillä, ulkopuolisilta m.m. HobbyHallin kiinalaisilta myyjiltä en enää tilaa, kertaerehdytys ja korjauksen mahdottomuus riittää.",3,https://hobbyhall.fi/fi/review/2393/2973#review-10,fi
placeholder,"Todella tärkeä, on tullut tosi kovaan käyttöön.",5,https://hobbyhall.fi/fi/review/2393/2973#review-10,fi
placeholder,"Tuntui vähän ämpäriltä,mutta ajaa asiansa",3,https://hobbyhall.fi/fi/review/2393/2973#review-10,fi
placeholder,Tullut tarpeeseen ja kestänyt käyttöä hyvin,5,https://hobbyhall.fi/fi/review/2393/2973#review-10,fi
placeholder,Hyvin on toiminut mökillä käytössä.,5,https://hobbyhall.fi/fi/review/2393/2973#review-10,fi
placeholder,"Vähän matala, mutta ajaa tarkoituksen",4,https://hobbyhall.fi/fi/review/2393/2973#review-10,fi
placeholder,Tuote oli kehnosti pakattu,4,https://hobbyhall.fi/fi/review/2393/2973#review-10,fi
placeholder,"Tosi kätevä reissuvessa ja mökille ""yöastiaksi"". Helppo tyhjentää ja pitää puhtaana.",4,https://hobbyhall.fi/fi/review/2393/2973#review-10,fi
placeholder,"Tuote toimii todella hyvin mökillä varawc:nä niin, ettei tarvitse yöllä kävellä huussiin.",5,https://hobbyhall.fi/fi/review/2393/2973#review-10,fi
placeholder,Kätevä pikkuvessa. Käytetty yövessana. Lapset tykkää.,5,https://hobbyhall.fi/fi/review/2393/2973#review-10,fi
placeholder,Käytössä on ja hyvin käytännöllinen hinta/laatu kohdallaan,5,https://hobbyhall.fi/fi/review/2393/2973#review-10,fi
placeholder,"Nopea toimitus. Tuote tilattiin ilman suunniteltua tarkoitusta, mutta osoittautui loistavaksi varavessaksi. Mökillä ulkohuussi 30m päässä mökistä. Oli kylmä, myrskysateinen syksypäivä kun mentiin mökille. Iltapimeässä kyykkypissa sateessa tai liukas polku huussiin yövaatteissa, tuntu välttämättömältä pahalta. Paitsi, että onneksi oli juuri hommattu tällainen näppärä sisäveski! Iso biopussi pönttöön, pohjalle huussikuiviketta ja sisäveski oli valmis! Istumakorkeuskin oli erittäin hyvä. Tulee olemaan varavessana jatkossakin niin metsää raivatessa, vaunuilemassa kuin mökilläkin.",5,https://hobbyhall.fi/fi/review/2393/2973#review-10,fi
placeholder,Hyvä tuote ja sopiva hinta.,5,https://hobbyhall.fi/fi/review/2393/2973#review-10,fi
placeholder,"Lapselle sopiva ,ei vanhukselle.",2,https://hobbyhall.fi/fi/review/2393/2973#review-10,fi
placeholder,Kiitos paljon hyvä on pytty,4,https://hobbyhall.fi/fi/review/2393/2973#review-10,fi
placeholder,Toimii. Bioska pussi sisään niin on myös siistiä.,4,https://hobbyhall.fi/fi/review/2393/2973#review-10,fi
placeholder,Hyvä toimiva tuote.,5,https://hobbyhall.fi/fi/review/2393/2973#review-10,fi
placeholder,Loistava yöpisuastia mökille.,5,https://hobbyhall.fi/fi/review/2393/2973#review-10,fi
placeholder,Kätevä matka-wc esimerkiksi sähkökatkojen varalta,4,https://hobbyhall.fi/fi/review/2393/2973#review-10,fi
placeholder,"Liian matala käyttöön, piti rakentaa koroke alle!",3,https://hobbyhall.fi/fi/review/2393/2973#review-10,fi
placeholder,Hyvälaatuinen ja kätevä,4,https://hobbyhall.fi/fi/review/2393/2973#review-10,fi
placeholder,Läpinäkyvä pakkaus vähän keljutti.,5,https://hobbyhall.fi/fi/review/2393/2973#review-10,fi
placeholder,"Hyvä tuote. Toimii niin kuin odotettiinkin, ei tarvitse yöllä puuceehen kävellä!",4,https://hobbyhall.fi/fi/review/2393/2973#review-10,fi
placeholder,"Nopea toimitus, tuote tulee mökkikäyttöön",4,https://hobbyhall.fi/fi/review/2393/2973#review-10,fi
placeholder,"Ihan ok, ajaa asiansa.",5,https://hobbyhall.fi/fi/review/2393/2973#review-10,fi
placeholder,Kätevä tuote mökillä,5,https://hobbyhall.fi/fi/review/2393/2973#review-10,fi
placeholder,"Ajaa asiansa, mutta toimituksessa kansi rikki. Olen tilannut 2 ja kummassakin samajuttu, muuten tyytyväinen",4,https://hobbyhall.fi/fi/review/2393/2973#review-10,fi
placeholder,"Liian kovaa muovia . Ämpärissä oli reikä jo tullessa ja istuin halkesi melko nopeasti ! Surkea tuote , ei olisi pitänyt luottaa halpaan !",1,https://hobbyhall.fi/fi/review/2393/2973#review-10,fi
placeholder,"Kevyt ja sopivan kokoinen astia. Jos haluat ämpärin minkä reunoilla voi istua, niin tässä on. Muuten tavallinen ämpäri ajaa saman asian. Mökille, retkelle ja lapsiperheille hyvä tai putkiremontin ajaksi. Olen tyytyväinen.",4,https://hobbyhall.fi/fi/review/2393/2973#review-10,fi
placeholder,Toimiva tuote - nopea toimitus.,5,https://hobbyhall.fi/fi/review/2393/2973#review-10,fi
placeholder,"Kiva kevyt ratkaisu mökille, kun pimenevinä iltoina ei viitsi lähteä yöpissalle huussiin.",4,https://hobbyhall.fi/fi/review/2393/2973#review-10,fi
placeholder,"Pieni, kuin tavallinen ämpäri, pakattu vain ""elmukelmuun""",1,https://hobbyhall.fi/fi/review/2393/2973#review-10,fi
placeholder,Hinta/laatusuhde hyvä.,5,https://hobbyhall.fi/fi/review/2393/2973#review-10,fi
placeholder,"Tuote oli pakattu elmukelmuun, joten ensimmäinen lähetys oli rikki, siitä alkoi taas säätö myyjän ja laskutuksen kanssa. Ja tuote toimitettiin eri paikkaan mihin oli tilattu, ylimääräisiä kuluja siitäkin syntyi!",4,https://hobbyhall.fi/fi/review/2393/2973#review-10,fi
placeholder,Pelastus putkiremonttia varten. Istumakorkeus on riittävä ja sanko kevyt tyhjätä.,5,https://hobbyhall.fi/fi/review/2393/2973#review-10,fi
placeholder,Tuote vastaa sitä mitä halusin.,5,https://hobbyhall.fi/fi/review/2393/2973#review-10,fi
placeholder,Hinta / laatu kaikkinensa ok.,4,https://hobbyhall.fi/fi/review/2393/2973#review-10,fi
placeholder,Toimii kuten pitääkin,4,https://hobbyhall.fi/fi/review/2393/2973#review-10,fi
placeholder,Selkäsairaalle hyvä apu kipujen ollessa pahimmillaan,5,https://hobbyhall.fi/fi/review/2393/2973#review-10,fi
placeholder,Vaikka se ei piti haise mutta kyllä se niin va on muuten hyvä,3,https://hobbyhall.fi/fi/review/2393/2973#review-10,fi
placeholder,Ekologinen vaihtoehto sähkökatkoihin.,5,https://hobbyhall.fi/fi/review/2393/2973#review-10,fi
placeholder,"Muuten hyvä, mutta hieman pienikokoinen.",3,https://hobbyhall.fi/fi/review/2393/2973#review-10,fi
placeholder,Jos on käyttöä ni suosittelen.,4,https://hobbyhall.fi/fi/review/2393/2973#review-10,fi
placeholder,Käyttötarkoitukseensa ja hintaansa nähden viiden tähden tuote.,5,https://hobbyhall.fi/fi/review/2393/2973#review-10,fi
placeholder,Toimiva ratkaisu mökille vanhan ihmisen öiseen tarpeeseen.,4,https://hobbyhall.fi/fi/review/2393/2973#review-10,fi
placeholder,Hyvä yövessa mökille,5,https://hobbyhall.fi/fi/review/2393/2973#review-10,fi
placeholder,Näppärä ja kevyt.,5,https://hobbyhall.fi/fi/review/2393/2973#review-10,fi
placeholder,"Lapsiperheille pienimmille ehkä sopiva ,mutta ei isommille .Roskasankona kyllä kätevä.",3,https://hobbyhall.fi/fi/review/2393/2973#review-10,fi
placeholder,Kätevä käyttää!!,5,https://hobbyhall.fi/fi/review/2393/2973#review-10,fi
placeholder,Tuote ylitti odotukseni. Toimitus oli nopea. Olen oikein tyytyväinen,5,https://hobbyhall.fi/fi/review/2393/2973#review-10,fi
placeholder,Kätevä tuote ja edullinen,5,https://hobbyhall.fi/fi/review/2393/2973#review-10,fi
placeholder,"Hyvä hinta/laatusuhde. Kätevä käyttää veneretkillä, mökillä ym.",5,https://hobbyhall.fi/fi/review/2393/2973#review-10,fi
placeholder,Erittäin hyvä yöastia esim mökillä talvella jossa ulko huussi.,4,https://hobbyhall.fi/fi/review/2393/2973#review-10,fi
placeholder,"Vähän pieni, luulin siinä olevan sisä ämpärin.",4,https://hobbyhall.fi/fi/review/2393/2973#review-10,fi
placeholder,Laatu ei ole kovin hyvä,2,https://hobbyhall.fi/fi/review/1248/1388#review-10,fi
placeholder,Ihan hyvä perus monitoimikeitin joka on ollut meillä jo 5 kk päivittäisessä käytössä. Ei kovinkaan paljon ohjelmia mutta kyllä millä pärjää. Sisäkattilan kannattaa pestä käsin.,4,https://hobbyhall.fi/fi/review/1248/1388#review-10,fi
placeholder,"Tosi hyvä, hyvä laatu",5,https://hobbyhall.fi/fi/review/1248/1388#review-10,fi
placeholder,"Tuote on hyvä, olen tyytyväinen.",5,https://hobbyhall.fi/fi/review/1248/1388#review-10,fi
placeholder,"Multicookerin sisälle laitettu rikkinäinen muovi mittakulho joka ei kuljetuksessa ole voinut rikkoutua, lisänä tuotteen mukana olisi odottanut enemmän ohjeita ja reseptejä ne jäävät nyt oman luovuuden varaan. (8reseptiä)",2,https://hobbyhall.fi/fi/review/1248/1388#review-10,fi
placeholder,Kiitos palvelusta!,5,https://hobbyhall.fi/fi/review/1248/1388#review-10,fi
placeholder,Meni rikki kahden kuukauden päästä......,1,https://hobbyhall.fi/fi/review/1248/1388#review-10,fi
placeholder,Hyvä ja monipuolinen,5,https://hobbyhall.fi/fi/review/1248/1388#review-10,fi
placeholder,"Ihan hyvä, kun ensin opettelee käyttämään. Ainoastaan kansi voisi aueta toiseen suuntaan.",5,https://hobbyhall.fi/fi/review/1248/1388#review-10,fi
placeholder,Ruoka helposti palaa pohjaan eikä voitelu auta.,1,https://hobbyhall.fi/fi/review/1248/1388#review-10,fi
placeholder,"Sain tämän uuden oston, erittäin huono toimitus",1,https://hobbyhall.fi/fi/review/1248/1388#review-10,fi
placeholder,Kiitos. Oli nopea toimitus. Käyttöviikon aikana ei ollut poikkeamia. Kaikki on ohjeiden mukaan.,5,https://hobbyhall.fi/fi/review/1248/1388#review-10,fi
placeholder,Kaikki on erittäin hyvää. Kiitos,5,https://hobbyhall.fi/fi/review/1248/1388#review-10,fi
placeholder,Hienoa tuotee)))))))))))))))))))),5,https://hobbyhall.fi/fi/review/1248/1388#review-10,fi
placeholder,"Hyvää laite, toimitus on ok.",5,https://hobbyhall.fi/fi/review/1248/1388#review-10,fi
placeholder,Recipe kirja mukana.,5,https://hobbyhall.fi/fi/review/1248/1388#review-10,fi
placeholder,"Toimitettu odotettua nopeammin. Sähkökulutus on alhainen. Ruoan sekoittaminen on hankalaa, koska kansi avautuu oikealle. Kaikki muu on hyvin!",5,https://hobbyhall.fi/fi/review/1248/1388#review-10,fi
placeholder,"Hyvin valmistaa riisin, lihan ja kalan. Reseptit toimivia. Tuotteeseen oli tullut painauma joko ennen pakkaamista tai kuljetuksessa. Ei onneksi vaikuttanut toimivuuteen. Hyvä hinta-laatusuhde.",5,https://hobbyhall.fi/fi/review/1248/1388#review-10,fi
placeholder,"Tuote toimitettiin nopeasti, pidin kaikesta",5,https://hobbyhall.fi/fi/review/1248/1388#review-10,fi
placeholder,Helppokäyttöinen,5,https://hobbyhall.fi/fi/review/1248/1388#review-10,fi
placeholder,Tosi hyvää ja halpa,5,https://hobbyhall.fi/fi/review/1248/1388#review-10,fi
placeholder,Pata saapui kotiini nopeasti. Suosittelen ostamaan. Helppokäyttöinen ja upea liesi,5,https://hobbyhall.fi/fi/review/1248/1388#review-10,fi
placeholder,"Tosi hyvä, vahan isompi mutta se on ok.",5,https://hobbyhall.fi/fi/review/1248/1388#review-10,fi
placeholder,"Hyvä tuote, hyvin toimii",5,https://hobbyhall.fi/fi/review/1248/1388#review-10,fi
placeholder,"tuote on täydellinen, et tule pettymään, jos kokeilet sitä",5,https://hobbyhall.fi/fi/review/1248/1388#review-10,fi
placeholder,Tosi hyvä laite toimii tosi hyvin ja saa maukasta ruokaa,5,https://hobbyhall.fi/fi/review/1248/1388#review-10,fi
placeholder,Käytännöllinen ja helppo käyttää . Maukkaat ruoat ilman suurta vaivaa. Suosittelen .,5,https://hobbyhall.fi/fi/review/1248/1388#review-10,fi
placeholder,"Monitoimikeitin on rikki kahdeksannen käyttökerran jälkeen. Kauppa ei suostu korjaamaan sitä, vaikka sillä on kahden vuoden takuu.",1,https://hobbyhall.fi/fi/review/1248/1388#review-10,fi
placeholder,"Tuote muuten hyvä, mutta reseptikirja hyvin niukka ja osin puutteelinen",3,https://hobbyhall.fi/fi/review/1248/1388#review-10,fi
placeholder,Ei olen hyvä tuotte,3,https://hobbyhall.fi/fi/review/1248/1388#review-10,fi
placeholder,"Tilasin keittimen, mutta kansi ei pysynyt auki ilman tukea. Sain uuden, jossa oli sama vika ja jonka toinen ""kylki"" oli sisäänpäin lommolla, mutta ajattelin, että pidän sen, sillä keitin toimii silti, ja kannen sain pysymään auki laittamalla kahvaan painoa. Neljännellä käyttökerralla keitin pimeni kokonaan, siihen ei tule virtaa, joten se on nyt ongelmajäte. Jos se olisi toiminut niin kuin luvataan, se olisi ollut erinomainen.",2,https://hobbyhall.fi/fi/review/1248/1388#review-10,fi
placeholder,Tosi hyvä kiitos tuotteesta,5,https://hobbyhall.fi/fi/review/1248/1388#review-10,fi
placeholder,"tuote on erittäin hyvä, kiitos",5,https://hobbyhall.fi/fi/review/1248/1388#review-10,fi
placeholder,Tällä on kivaa tehdä puuroa aamuksi. Illalla ladataan aineet pataan ja valitaan sopiva aika. Aamulla on herkkupuuro valmis!,5,https://hobbyhall.fi/fi/review/1248/1388#review-10,fi
placeholder,Hyvä ja käytännöllinen laite toimii kaikinpuolin,5,https://hobbyhall.fi/fi/review/1248/1388#review-10,fi
placeholder,Erittäin hyvä tuote. Toimii erinomaisesti,5,https://hobbyhall.fi/fi/review/1248/1388#review-10,fi
placeholder,"On tosi tehokas ja hyvää, helppo käydä",5,https://hobbyhall.fi/fi/review/1248/1388#review-10,fi
placeholder,"On tosi hyvää, ja tehokas",5,https://hobbyhall.fi/fi/review/1248/1388#review-10,fi
placeholder,Tuote toimi niin kuin pitikin suosittelen kaikille.,5,https://hobbyhall.fi/fi/review/1248/1388#review-10,fi
placeholder,Tällä valmistaa erinomaista riisiä. Suosittelen.,5,https://hobbyhall.fi/fi/review/1248/1388#review-10,fi
placeholder,Tuote oli just sellainen kuin halusinkin.,5,https://hobbyhall.fi/fi/review/1248/1388#review-10,fi
placeholder,Me pidimme tästä teekannusta todella paljon! Ostimme sen itsellemme ja myös lahjaksi ystäville!!!,5,https://hobbyhall.fi/fi/review/593/593#review-10,fi
placeholder,Toimii hyvin. Hienot värit lämmön mukaan.,5,https://hobbyhall.fi/fi/review/593/593#review-10,fi
placeholder,Hinta ja laatu kohtaavat. Tuote on juuri sellainen kuin kuvauksessa on luvattu.,5,https://hobbyhall.fi/fi/review/593/593#review-10,fi
placeholder,Lämpötilan valinta on hyvä ominaisuus.,5,https://hobbyhall.fi/fi/review/593/593#review-10,fi
placeholder,Toimii hyvin ja on nopea,4,https://hobbyhall.fi/fi/review/593/593#review-10,fi
placeholder,toimii ja todella nopea toimitus.,5,https://hobbyhall.fi/fi/review/593/593#review-10,fi
placeholder,Erittän hyvä ja tehokas.,5,https://hobbyhall.fi/fi/review/593/593#review-10,fi
placeholder,"Olin tyytyväinen tekniikkaan - kaunis, kätevä. Mutta! Laite meni rikki alle vuoden työskentelyn jälkeen!",1,https://hobbyhall.fi/fi/review/593/593#review-10,fi
placeholder,Kiitos hienon näköistä kun valojen väri muuttuu lämpö asteen muuttuessa hyvä ja toimiva keitin,4,https://hobbyhall.fi/fi/review/593/593#review-10,fi
placeholder,"Forme ainut, mutta paras, toivon kestävyyttä.",5,https://hobbyhall.fi/fi/review/593/593#review-10,fi
placeholder,Toimii oikein hyvin. Värivalot veden lämpötilasta on hauska yksityiskohta. Bonusta myöskin lämpimänä pito toiminto.,5,https://hobbyhall.fi/fi/review/593/593#review-10,fi
placeholder,Toimitus oli supernopea ja tuote on loistava.,5,https://hobbyhall.fi/fi/review/593/593#review-10,fi
placeholder,Rakastin vedenkeitintä.,5,https://hobbyhall.fi/fi/review/593/593#review-10,fi
placeholder,Hienosti väri vaihtuu veden lämmetessä. Vaikuttaa ihan hyvältä vedenkeittimeltä.,5,https://hobbyhall.fi/fi/review/593/593#review-10,fi
placeholder,"Hyvä vedenkeitin, jopa parempi kuin osa kalliimmista merkkituotteista. Lasisen kannun ansiosta näkee heti paljonko vettä on jäljellä. Eikä lasikannu paina niin paljon, kuin voisi kuvitella. Hienot värit eri asteissa ja parasta tässä keittimessä on se, että se näyttää asteluvut kun vesi lämpenee. Eli näkee suoraan, minkä asteista vesi on. Todella hyvä ominaisuus! Kuin myös kahden tunnin lämpimänäpito.",5,https://hobbyhall.fi/fi/review/593/593#review-10,fi
placeholder,Ilo silmälle ja toimii kuten pitääkin.,5,https://hobbyhall.fi/fi/review/593/593#review-10,fi
