otsikko,teksti,tahdet,url,kieli
placeholder,"Miellyttävät! Olen käyttänyt ""Sloggi"" tuotteita ( alusvaatteita: housuja, r-liivejä...) päivittäin, (vuosien! ajan, koko ""aikuisikäni"") ilman negatiivisia tuntemuksia! Malli hyvä, materiaali miellyttävä, säilyttää ""kuosin""! Ei valittamista!",4,https://www.prisma.fi/tuotteet/100086327/sloggi-maxi-basic-naisten-alushousut-3-pack-100086327,fi
placeholder,Mukavat alusvaatteet. Käytän mielelläni näitä alusvaatteita.,4,https://www.prisma.fi/tuotteet/100086327/sloggi-maxi-basic-naisten-alushousut-3-pack-100086327,fi
placeholder,"Ominaisuudet hyvät. Puuvillahousuksi tosi kestävät ja istuvat. Kauneutta kaipaan, pitsimalli slogit ovat hävinneet myynnistä. ????",4,https://www.prisma.fi/tuotteet/100086327/sloggi-maxi-basic-naisten-alushousut-3-pack-100086327,fi
placeholder,Napakat. Olen ostanut näitä jo useinkin ja pitkään.,4,https://www.prisma.fi/tuotteet/100086327/sloggi-maxi-basic-naisten-alushousut-3-pack-100086327,fi
placeholder,Parhaat alkkarit. Housut tulevat kivasti vatsan päälle,4,https://www.prisma.fi/tuotteet/100086327/sloggi-maxi-basic-naisten-alushousut-3-pack-100086327,fi
placeholder,"Hyvä istuvuus (korkea vyötärö). Olen käyttänyt Sloggi alushousuja vuosia, 25-30 vuotta. Merkkiä en vaihda.",5,https://www.prisma.fi/tuotteet/100086327/sloggi-maxi-basic-naisten-alushousut-3-pack-100086327,fi
placeholder,mukavat käytää sopivat minun vartalooni hyvin. Olen ostanut jo monia vuosia kyseisiä alusvaatteita ja olen niihin erittäin tyytyväinen.,5,https://www.prisma.fi/tuotteet/100086327/sloggi-maxi-basic-naisten-alushousut-3-pack-100086327,fi
placeholder,"Sloggi max. Hyväntuntuiset päällä, ohut, mutta napakka materiaali, hyvän malliset. Olen tyytyväinen",4,https://www.prisma.fi/tuotteet/100086327/sloggi-maxi-basic-naisten-alushousut-3-pack-100086327,fi
placeholder,Hyvän laatuiset. Eivät veny ja pitavät kuosinsa.,5,https://www.prisma.fi/tuotteet/100086327/sloggi-maxi-basic-naisten-alushousut-3-pack-100086327,fi
placeholder,Todella mukavat pitää ja kestävät. Olen käyttänyt jo vuosia,4,https://www.prisma.fi/tuotteet/100086327/sloggi-maxi-basic-naisten-alushousut-3-pack-100086327,fi
placeholder,Sopivat ja mukavat. Olen hyvin tyytyväinen Lööpit,5,https://www.prisma.fi/tuotteet/100086327/sloggi-maxi-basic-naisten-alushousut-3-pack-100086327,fi
placeholder,"Ikuinen Sloggi fani. Ostin, jälleen kerran iki ihanat slogit. Olen käyttänyt ko alushousuja aina enkä taatusti tule merkkiä vaihtamaan. Ei ole voittanutta.",5,https://www.prisma.fi/tuotteet/100086327/sloggi-maxi-basic-naisten-alushousut-3-pack-100086327,fi
placeholder,Istuvuus täydellinen. Olen ostanut kyseisiä housuja useita. Tuote on mukava yllä. Istuvuus täydellinen. Ei kiristä tai purista. Asiallisen näköiset päällä.,4,https://www.prisma.fi/tuotteet/100086327/sloggi-maxi-basic-naisten-alushousut-3-pack-100086327,fi
placeholder,"Sloggi alushousut. Laadukkaat ja kestävät alushousut. Olen käyttäneet niitä jo kauan, enkä muita alushousuja näytäkään.",5,https://www.prisma.fi/tuotteet/100086327/sloggi-maxi-basic-naisten-alushousut-3-pack-100086327,fi
placeholder,"hyvät ja istuvat. olen aina käyttänyt sloggeja, koska ne ovat niin hyväntuntuiset päällä",4,https://www.prisma.fi/tuotteet/100086327/sloggi-maxi-basic-naisten-alushousut-3-pack-100086327,fi
placeholder,Mahtavat ominaisuudet. Ainoat naisten alushousut jotka säilyttävät kuosinsa.,4,https://www.prisma.fi/tuotteet/100086327/sloggi-maxi-basic-naisten-alushousut-3-pack-100086327,fi
placeholder,Istuvat hyvin. Parhaat alkkarit ikä ihmisille.Pehmeät ja istuvat hyvin.,5,https://www.prisma.fi/tuotteet/100086327/sloggi-maxi-basic-naisten-alushousut-3-pack-100086327,fi
placeholder,Hyvä hinta-laatusuhde. Kuukauden käytössä ja hyvät ovat. Mitoitus mainio ja 3 paria pakkauksessa hinnaltaan mainiot.,4,https://www.prisma.fi/tuotteet/100086327/sloggi-maxi-basic-naisten-alushousut-3-pack-100086327,fi
placeholder,"Hyvin istuvat. Ostin Sloggi -Maxi Basic naisten alushousut, en ole vuosikymmeniin muita käyttänytkään. Ne ovat niin mukavat käytössä ja kestävät lukemattomia pesukertoja. Parhaat!",5,https://www.prisma.fi/tuotteet/100086327/sloggi-maxi-basic-naisten-alushousut-3-pack-100086327,fi
placeholder,"Perus alushousut. Olen ostanut useammat sloggi Maxi basic alushousut ja aluksi ovat hyvät, muutaman pesun jälkeen saumat repeävät edestä haarovälin kohdalta. Muuten olen ollut tyytyväinen tuotteeseen.",3,https://www.prisma.fi/tuotteet/100086327/sloggi-maxi-basic-naisten-alushousut-3-pack-100086327,fi
placeholder,Mukavat ja laadukkat alushousut. Olen ostanut Slogeja jo vuosia !,5,https://www.prisma.fi/tuotteet/100086327/sloggi-maxi-basic-naisten-alushousut-3-pack-100086327,fi
placeholder,"Ostin tuotteen. Äidille ostin, äiti käyttää aina sloggihousuja. On ollut tyytyväinen.",5,https://www.prisma.fi/tuotteet/100086327/sloggi-maxi-basic-naisten-alushousut-3-pack-100086327,fi
placeholder,Parhaat minun pepulleni. En ole ostanut muita 10 vuoteen.,5,https://www.prisma.fi/tuotteet/100086327/sloggi-maxi-basic-naisten-alushousut-3-pack-100086327,fi
placeholder,"Parhaat peruspöksyt mammamallille. Olen käyttänyt samaa merkkiä jo vuosikymmeniä, parempia ei ole löytynyt.",5,https://www.prisma.fi/tuotteet/100086327/sloggi-maxi-basic-naisten-alushousut-3-pack-100086327,fi
placeholder,"Kohtalaiset alkkarit. Materiaali on tainnut muuttua aiemmasta, jotenkin ohut. Aiemmin ostamissani olen huomannut, että reikintyvät todella nopeasti, aina haarasaumasta. Tätä ei aiemmin tapahtunut.",3,https://www.prisma.fi/tuotteet/100086327/sloggi-maxi-basic-naisten-alushousut-3-pack-100086327,fi
placeholder,Hyvät housut. Olen käyttänyt useamman vuoden Sloggi housuja ja ollut tyytyväinen.,3,https://www.prisma.fi/tuotteet/100086327/sloggi-maxi-basic-naisten-alushousut-3-pack-100086327,fi
placeholder,"Tyytyväinen käyttäjä. Ei olleet ensimmäiseni. Varma laatutuote,johon en pettynyt aikaisemmin enkä nytkään.",4,https://www.prisma.fi/tuotteet/100086327/sloggi-maxi-basic-naisten-alushousut-3-pack-100086327,fi
placeholder,"Erittäin mukavat. Ostin muutama viikko sitten, olen erittäin tyytyväinen",5,https://www.prisma.fi/tuotteet/100086327/sloggi-maxi-basic-naisten-alushousut-3-pack-100086327,fi
placeholder,Koko tarvittavan sopiva. Olen ollut tyytyväinen ostoon.,4,https://www.prisma.fi/tuotteet/100086327/sloggi-maxi-basic-naisten-alushousut-3-pack-100086327,fi
placeholder,Luotettava käyttötuote. olen ollut tyytyväinen ko tuotteeseen yli 10 v,4,https://www.prisma.fi/tuotteet/100086327/sloggi-maxi-basic-naisten-alushousut-3-pack-100086327,fi
placeholder,"Minulle sopiva mitoitus. Pysyvät kuosissaan pesujen jälkeen,pitävät hyvin väriään,kestävät hyvin käyttöä miellyttävät yllä.",5,https://www.prisma.fi/tuotteet/100086327/sloggi-maxi-basic-naisten-alushousut-3-pack-100086327,fi
placeholder,"Loistava. Olen ostanut näitä housuja itselleni aika kauan aikaa. olen yrittänyt myös muita housuja, mutta aina palannut näihin takasin koska: - pysyvät parhaiten paikallaan - värilliset helppo pestä muun pyykin matkassa,hox ei huuhteluainetta - kestäviä",5,https://www.prisma.fi/tuotteet/100086327/sloggi-maxi-basic-naisten-alushousut-3-pack-100086327,fi
placeholder,Tuttu tuote jo vuosien ajan. Olen ostanut Sloggi Maxi Basic pikkuhousuja pari kertaa vuodessa 3-packin. Malli ja käyttömukavuus paras minulle.,4,https://www.prisma.fi/tuotteet/100086327/sloggi-maxi-basic-naisten-alushousut-3-pack-100086327,fi
placeholder,Sopivat minulle. Olen käyttänyt Sloggi Maxia jo vuosikaudet ja ne ovat minulle erittäin sopivat,5,https://www.prisma.fi/tuotteet/100086327/sloggi-maxi-basic-naisten-alushousut-3-pack-100086327,fi
placeholder,"Miellyttävät päällä. Olen käyttänyt sloggi maxi basic alushousuja jo useamman vuoden ajan. Ainoat alushousut jotka ovat miellyttävät päällä, eivät hierrä, eikä kierry rullalle !! Ei venähdä useammankaan pesun jälkeen.",5,https://www.prisma.fi/tuotteet/100086327/sloggi-maxi-basic-naisten-alushousut-3-pack-100086327,fi
placeholder,"Aivan liian pienet. Ostin tämän kuukausi sitten ja petyin ostokseeni. Olen itse kokoa M ja otin varmuuden vuoksi normaalia isomman koon 40. Koko oli kuitenkin aivan liian pieni ja vastasi ehkä XS tai 34 kokoa, enkä voinut käyttää niitä.",2,https://www.prisma.fi/tuotteet/100086327/sloggi-maxi-basic-naisten-alushousut-3-pack-100086327,fi
placeholder,"Oikein hyvät alushousut. Olen ollut tyytyväinen ostokseeni, kun sain vaihtaakin ne sopivampaan kokoon väärikäsityksen takia.",5,https://www.prisma.fi/tuotteet/100086327/sloggi-maxi-basic-naisten-alushousut-3-pack-100086327,fi
placeholder,"Käytän vain Sloggi-naisten alushousuja. Ostin tuotteen jokunen viikko sitten, mutta olen käyttänyt Sloggeja nelisenkymmentä vuotta.",5,https://www.prisma.fi/tuotteet/100086327/sloggi-maxi-basic-naisten-alushousut-3-pack-100086327,fi
placeholder,Klassinen ja varma valinta. Mukava ja huomaamaton käyttää,4,https://www.prisma.fi/tuotteet/100086327/sloggi-maxi-basic-naisten-alushousut-3-pack-100086327,fi
placeholder,taatua sloggi laatua. yhtä hyvät ku aijemmin ostetut sloggi alkkarit.,5,https://www.prisma.fi/tuotteet/100086327/sloggi-maxi-basic-naisten-alushousut-3-pack-100086327,fi
placeholder,Loistava tuote. Kestävät ja materiaali erittäin miellyttävä.,4,https://www.prisma.fi/tuotteet/100086327/sloggi-maxi-basic-naisten-alushousut-3-pack-100086327,fi
placeholder,Mahtavat ominaisuudet. Olen todella tyytyväinen.,5,https://www.prisma.fi/tuotteet/100086327/sloggi-maxi-basic-naisten-alushousut-3-pack-100086327,fi
placeholder,Pienet kokomerkintään nähden. Ovat reilusti pienemmät kuin mitä kokomerkintä on.,3,https://www.prisma.fi/tuotteet/100086327/sloggi-maxi-basic-naisten-alushousut-3-pack-100086327,fi
placeholder,"hyvät, olen käyttänyt sloggeja vuosikausia ja hyvä. ostin vastakin muutama viikko sitten",4,https://www.prisma.fi/tuotteet/100086327/sloggi-maxi-basic-naisten-alushousut-3-pack-100086327,fi
placeholder,Mukavat päällä. Mukavat ja kivat päällä.,5,https://www.prisma.fi/tuotteet/100086327/sloggi-maxi-basic-naisten-alushousut-3-pack-100086327,fi
placeholder,"Hyvät ominaisuudet. Olen jo monta vuotta käyttänyt Sloggi alushousuja koska ne ovat niin tukevat, kestävät, ja laatukkaita.",4,https://www.prisma.fi/tuotteet/100086327/sloggi-maxi-basic-naisten-alushousut-3-pack-100086327,fi
placeholder,"Naisen paras ystävä. Istuvat tosi hyvin, ei turhia saumoja, joten eivät hankaa eivätkä hierrä, eivät näy tiukkojenkaan päällyshousujen läpi. Puuvillaisina ovat kesähelteilläkin miellyttävät ja talvella lämpimät.",5,https://www.prisma.fi/tuotteet/100086327/sloggi-maxi-basic-naisten-alushousut-3-pack-100086327,fi
placeholder,"Mukavan joustavat ja kestävät. Ostin jälleen sloggihousuja, olen käyttänyt niitä useamman vuoden ,olen ollut tyytyväinen varsinkin niiden laatuun ja joustavuuteen. En vaihda merkkiä.",5,https://www.prisma.fi/tuotteet/100086327/sloggi-maxi-basic-naisten-alushousut-3-pack-100086327,fi
placeholder,"Mahtavat. Olen ostanut jo useamman paketin kyseisiä housuja. Ovat kestäviä, napakoita ja hyvin istuvia!",5,https://www.prisma.fi/tuotteet/100086327/sloggi-maxi-basic-naisten-alushousut-3-pack-100086327,fi
placeholder,"Mahtava yllä. Ostin nämä kaksi viikkoa sitten, pitää pintansa",4,https://www.prisma.fi/tuotteet/100086327/sloggi-maxi-basic-naisten-alushousut-3-pack-100086327,fi
placeholder,"Hyvin istuu päälle. Ostin sloggit kuukausi sitten, minun kropalle hyvin istuvat pikkarit.",5,https://www.prisma.fi/tuotteet/100086327/sloggi-maxi-basic-naisten-alushousut-3-pack-100086327,fi
placeholder,"Maailman mukavimmat päällä. Pehmeä materiaali, tulee riittävän ylös. Huippumukava päällä.",5,https://www.prisma.fi/tuotteet/100086327/sloggi-maxi-basic-naisten-alushousut-3-pack-100086327,fi
placeholder,"Hyvä housu. Olen käyttänyt yksinomaan Sloggeja varmaan 40 vuotta. Se kertokoon, mitä mieltä housuista olen.",5,https://www.prisma.fi/tuotteet/100086327/sloggi-maxi-basic-naisten-alushousut-3-pack-100086327,fi
placeholder,"laatu huonontunut huomattavasti vuosien mittaan,. KESTÄVYYS vähentynyt. En ymmärrä että pesuohje 95 astetta. kuka nykyään sitä käyttää. KESTÄVÄ PESUOHJE ITSE TUOTTEESSA PITÄISI PYSYÄ NÄKYVÄN KOKO VAATTEEN KÄYTTÖAJAN. nyt erittäin kummallinen irtolapussa.",3,https://www.prisma.fi/tuotteet/100086327/sloggi-maxi-basic-naisten-alushousut-3-pack-100086327,fi
placeholder,Hyvä tuote. Varma valinta. Ostan itselleni vain ja ainoastaan sloggeja.,5,https://www.prisma.fi/tuotteet/100086327/sloggi-maxi-basic-naisten-alushousut-3-pack-100086327,fi
placeholder,ihan ok näköiset pöksyt. Vaimo ollut tyytyväinen,5,https://www.prisma.fi/tuotteet/100086327/sloggi-maxi-basic-naisten-alushousut-3-pack-100086327,fi
placeholder,Tyytyväinen käyttäjä. Erinomainen istuvuus.,5,https://www.prisma.fi/tuotteet/100086327/sloggi-maxi-basic-naisten-alushousut-3-pack-100086327,fi
placeholder,Istuvat! Ne vaan on niin hyvät! Istuvat mukavaati ja ovat hyvää laatua.,4,https://www.prisma.fi/tuotteet/100086327/sloggi-maxi-basic-naisten-alushousut-3-pack-100086327,fi
placeholder,"Tietää mitä saa. sloggilla pitää paikkansa koot, ei tartte arvuutella ...",5,https://www.prisma.fi/tuotteet/100086327/sloggi-maxi-basic-naisten-alushousut-3-pack-100086327,fi
placeholder,Istuu kuin valettu. Parhaat XL-pikkuhousut. Suosittelen.,5,https://www.prisma.fi/tuotteet/100086327/sloggi-maxi-basic-naisten-alushousut-3-pack-100086327,fi
placeholder,Hyvät. En muista koska olen ostanut muita alushousuja kuin Sloggin. Aina tyytyväinen.,5,https://www.prisma.fi/tuotteet/100086327/sloggi-maxi-basic-naisten-alushousut-3-pack-100086327,fi
placeholder,"Varmaa Sloggi -laatua. Hyvin istuvat, perus alushousut.",4,https://www.prisma.fi/tuotteet/100086327/sloggi-maxi-basic-naisten-alushousut-3-pack-100086327,fi
placeholder,Istuvat hyvin. Hyvin sopiva muotoilu,4,https://www.prisma.fi/tuotteet/100086327/sloggi-maxi-basic-naisten-alushousut-3-pack-100086327,fi
placeholder,"Kestävät, mielyttävä pitää. Olen ostanut monta vuotta Slogin Basic alushousuja.",5,https://www.prisma.fi/tuotteet/100086327/sloggi-maxi-basic-naisten-alushousut-3-pack-100086327,fi
placeholder,"ihan hyvä. Nämä tuotteet ovat minulle tuttuja ennestään,sillä olen käyttänyt Sloggia jo vuosia.",5,https://www.prisma.fi/tuotteet/100086327/sloggi-maxi-basic-naisten-alushousut-3-pack-100086327,fi
placeholder,Erittäin tyytyväinen. Tuttu merkki.Aiempiin hankintoihin tyytyväinen,4,https://www.prisma.fi/tuotteet/100086327/sloggi-maxi-basic-naisten-alushousut-3-pack-100086327,fi
placeholder,Aikuisen naisen alus vaate. Olen tyytyväinen jo noin 30 vuotta,5,https://www.prisma.fi/tuotteet/100086327/sloggi-maxi-basic-naisten-alushousut-3-pack-100086327,fi
placeholder,Hyvät pikkarit. Olen ollut tyytyväinen,5,https://www.prisma.fi/tuotteet/100086327/sloggi-maxi-basic-naisten-alushousut-3-pack-100086327,fi
placeholder,"Laatu huononee koko ajan. Pari pesua kestää, sitten alkaa ratkeilla vyötärökuminauha irti. Koko ON aivan oikea mutta laatu huonoa nykyään.",1,https://www.prisma.fi/tuotteet/100086327/sloggi-maxi-basic-naisten-alushousut-3-pack-100086327,fi
placeholder,hyvät. vaimon mielestä erittäin hyvät,5,https://www.prisma.fi/tuotteet/100086327/sloggi-maxi-basic-naisten-alushousut-3-pack-100086327,fi
placeholder,"Parhaat housut. Olen aikaisemmin käyttänyt naitä, mutta hinnan vuoksi kokeilin toisen valmistajan housuja. Nyt olen kuitenkin palannut Sloggiin koska ne ovat niin pehmeät, tukevat ja kestävät. Enää eivät muut kelpaa.",4,https://www.prisma.fi/tuotteet/100086327/sloggi-maxi-basic-naisten-alushousut-3-pack-100086327,fi
placeholder,Pysyy jalassa ja joustavuus säilyy jotakuin. En nyt ole ostanut kun kokeilin toisia teidän tuotetta. Jotain on ihankun materiaalissa tapahtunut tuntuu ihankun puuvillaa olisi vähemmän tunne ehkä? Kuminauha ihankun olisi kovempaa?,4,https://www.prisma.fi/tuotteet/100086327/sloggi-maxi-basic-naisten-alushousut-3-pack-100086327,fi
placeholder,"Sloggi Maxi Hasic naisten alushousut, mainiot! Olen käyttänyt Sloggi Maxi Basic naisten alushousuja useita vuosia, sekä mustia, valoisa että beesin värisiä. Suosikkini ovat mustat. Pidän nimenomaan Sloggi Maxi- mallista, joka ulottuu vyötärölle asti. En henkilökohtaisesti pidä lantiomallista. Havaintoni mukaan Sloggi- housut ovat varsin hyvin kulutusta kestävät ja miellyttävät iholla.",5,https://www.prisma.fi/tuotteet/100086327/sloggi-maxi-basic-naisten-alushousut-3-pack-100086327,fi
placeholder,"Miellyttävät. Olen vuosia käyttänyt Sloggin alushousuja, eri malleja. Miellyttävät käyttää. Materiaali on vuosien varrells heikentynyt valitettavasti.",5,https://www.prisma.fi/tuotteet/100086327/sloggi-maxi-basic-naisten-alushousut-3-pack-100086327,fi
placeholder,"Hyvin istuvat, kestävät. Vuosien mittainen Sloggien käyttö, nykyisin vähän isompi koko. Olen hyvin tyytyväinen, ostan, käytän vastaisuudessakin. .",5,https://www.prisma.fi/tuotteet/100086327/sloggi-maxi-basic-naisten-alushousut-3-pack-100086327,fi
placeholder,"En käytä. En käytä moisia housuja. Vaimoni käyttää, mutta kun kysyitte mielipidettni ne ovat minulle nollan arvoiset.",1,https://www.prisma.fi/tuotteet/100086327/sloggi-maxi-basic-naisten-alushousut-3-pack-100086327,fi
placeholder,Oikein hyvät! Olen oikein tyytyväinen.,5,https://www.prisma.fi/tuotteet/100086327/sloggi-maxi-basic-naisten-alushousut-3-pack-100086327,fi
placeholder,"Näihin palaan aina. Parhaat puuvillapikkarit, korkeus sopiva ja kuminauha ei kutita, niinkuin monissa muissa vastaavissa. Yksi tähti pois, kun eivät ole enää niin kestävät kuin aiemmin.",4,https://www.prisma.fi/tuotteet/100086327/sloggi-maxi-basic-naisten-alushousut-3-pack-100086327,fi
placeholder,"Hyvä perusvaate. Olen ostanut jo vuosien ajan, hyvät jokapäiväisessä käytössä",4,https://www.prisma.fi/tuotteet/100086327/sloggi-maxi-basic-naisten-alushousut-3-pack-100086327,fi
placeholder,"Kestävä materiaali. Olen tyytyväinen siihen,että tuote säilyttää muotonsa pesusta pesuun.",5,https://www.prisma.fi/tuotteet/100086327/sloggi-maxi-basic-naisten-alushousut-3-pack-100086327,fi
placeholder,Sloggi Maxi. Sloggi alushousut ennen parempi laatuiset. Nykyään ratkeaa melko nopeasti vyötärönauhasta.,4,https://www.prisma.fi/tuotteet/100086327/sloggi-maxi-basic-naisten-alushousut-3-pack-100086327,fi
placeholder,"Hyvät perusalusvastteet. Ostin joitakin aikoja sitten sloggit, joita olen käyttänyt kymmeniä vuosia pehmeän ja hengittävän materiaalin vuoksi. Viimeaikoina maxit ovat olleet parhaita, koska ne pysyvät hyvin menossa mukana eikä lantiolle Synny vielä ylimääräisiä makkaroita.",4,https://www.prisma.fi/tuotteet/100086327/sloggi-maxi-basic-naisten-alushousut-3-pack-100086327,fi
placeholder,Kestävä hyvän laatuinen. Ostin kuukausi sitten vielä on ehjät!!,4,https://www.prisma.fi/tuotteet/100086327/sloggi-maxi-basic-naisten-alushousut-3-pack-100086327,fi
placeholder,Hyvä laatu. Ostin pitkästä aikaa normaali hintaset alushousut ja laatu oli aivan erilainen kuin ale tuotteissa. Laatu oli joustava ja pehmeä ja paksumpi. Jatkossa suosin normihinta tuotteita.,4,https://www.prisma.fi/tuotteet/100086327/sloggi-maxi-basic-naisten-alushousut-3-pack-100086327,fi
placeholder,"Olivat liian pienet, palautin kauppaan! Ei käyttökokemusta, koska palautin liian pienet kauppaan. :))",1,https://www.prisma.fi/tuotteet/100086327/sloggi-maxi-basic-naisten-alushousut-3-pack-100086327,fi
placeholder,Napakat ja istuvat. Ostin noin kk sitten ja olen tyytyväinen. Istuvat ja napakat. Tykkään.,5,https://www.prisma.fi/tuotteet/100086327/sloggi-maxi-basic-naisten-alushousut-3-pack-100086327,fi
placeholder,Laadukkaat alushousut. Ostan aina näitä. Ei ole parempia olemassa.,5,https://www.prisma.fi/tuotteet/100086327/sloggi-maxi-basic-naisten-alushousut-3-pack-100086327,fi
placeholder,Hyvän tuntuiset. Miellyttävän tuntuiset ja istuvat hyvin,4,https://www.prisma.fi/tuotteet/100086327/sloggi-maxi-basic-naisten-alushousut-3-pack-100086327,fi
placeholder,Luotettavaa laatua arkeen. Olen käyttänyt vastaavaa tuotetta jo vuosia. Käytössä mukavat päällä. Nyt ostin muutama viikko sitten ja olen taas tyytyväinen.,5,https://www.prisma.fi/tuotteet/100086327/sloggi-maxi-basic-naisten-alushousut-3-pack-100086327,fi
placeholder,Muuten hyvät mutta lahkeen reuna repeä vähänulla. Muuten hyvät mutta lahkeen käänteen reuna paikoin rikkoontuu.,3,https://www.prisma.fi/tuotteet/100086327/sloggi-maxi-basic-naisten-alushousut-3-pack-100086327,fi
placeholder,"Taattua laatua. Mukavat käytössä, hyvä malli, tosi kestävät.",5,https://www.prisma.fi/tuotteet/100086327/sloggi-maxi-basic-naisten-alushousut-3-pack-100086327,fi
placeholder,"Hyvä ostos. Olen ollut tyytyväinen ostokseeni, käytössä joka päivä. Istuu hyvin eikä hankaa, napakat.",4,https://www.prisma.fi/tuotteet/100086327/sloggi-maxi-basic-naisten-alushousut-3-pack-100086327,fi
placeholder,Hyvin istuvat ja kestävät. Olen käyttänyt tämän merkkisiä ja mallisia alushousuja jo vuosia. Ne istuvat hyvin ja ovat miellyttävät iholle.,4,https://www.prisma.fi/tuotteet/100086327/sloggi-maxi-basic-naisten-alushousut-3-pack-100086327,fi
placeholder,Pikkarit. Tyytyväinen ja ostan toistekin,4,https://www.prisma.fi/tuotteet/100086327/sloggi-maxi-basic-naisten-alushousut-3-pack-100086327,fi
placeholder,Edelleen laadukas. Olen tyytyväinen tuotteeseen. Käyttänyt vain Sloggeja 80-luvulta lähtien.,4,https://www.prisma.fi/tuotteet/100086327/sloggi-maxi-basic-naisten-alushousut-3-pack-100086327,fi
placeholder,Istuu todella hyvin. Laadukkaat ja kestävät,5,https://www.prisma.fi/tuotteet/100086327/sloggi-maxi-basic-naisten-alushousut-3-pack-100086327,fi
placeholder,Hyvin istuvat. Käytän yksinomaan slogeja,5,https://www.prisma.fi/tuotteet/100086327/sloggi-maxi-basic-naisten-alushousut-3-pack-100086327,fi
placeholder,"Parhaat! Käytän aina sloggeja, ne ovat yksinkertaisesti mukavimmat päällä ja kestävät.",5,https://www.prisma.fi/tuotteet/100086327/sloggi-maxi-basic-naisten-alushousut-3-pack-100086327,fi
placeholder,Parhaat alkkarit ikinä. Ostin kuukausi sitten ja olen ostanut monen.monet kerrat aiemminkin.Parempia en ole löytänyt!,5,https://www.prisma.fi/tuotteet/100086327/sloggi-maxi-basic-naisten-alushousut-3-pack-100086327,fi
placeholder,"En muuhun vaihtaisi. Olen koko aikuisikäni käyttänyt Sloggeja. Laatu on vain parantunut vuosien vieriessä. Mummi tarvitsee hyvin istuvat, hiertämättömät, peittävät housut. Olisikin mukava jos boxeri-malli palaisi myyntiin. Mummi 74 v",5,https://www.prisma.fi/tuotteet/100086327/sloggi-maxi-basic-naisten-alushousut-3-pack-100086327,fi
placeholder,Hyvät ominaisuudet. Olen ollut tyytyväinen.Hyvin istuvat ja joustavat,5,https://www.prisma.fi/tuotteet/100086327/sloggi-maxi-basic-naisten-alushousut-3-pack-100086327,fi
placeholder,kangasmateriaalin kestävyys heikentynyt paljon. en ole tyytyvinen kestävyyteen,2,https://www.prisma.fi/tuotteet/100086327/sloggi-maxi-basic-naisten-alushousut-3-pack-100086327,fi
placeholder,Ainoat mitä koskaan ostan. Olen käyttänyt niin kauan kun niitä on ollut. Olen yli 70v.,5,https://www.prisma.fi/tuotteet/100086327/sloggi-maxi-basic-naisten-alushousut-3-pack-100086327,fi
placeholder,Miellyttävät päällä. Ostin nämä kk sitten ja olen tyytyväinen.,4,https://www.prisma.fi/tuotteet/100086327/sloggi-maxi-basic-naisten-alushousut-3-pack-100086327,fi
placeholder,Hyvät ominaisuudet. Olleet monet hyvät käytössä. Olen ostanut niitä monta vuotta,5,https://www.prisma.fi/tuotteet/100086327/sloggi-maxi-basic-naisten-alushousut-3-pack-100086327,fi
placeholder,Hyvä perus tuote. Tuttu ja turvallinen tuote äidilleni,4,https://www.prisma.fi/tuotteet/100086327/sloggi-maxi-basic-naisten-alushousut-3-pack-100086327,fi
placeholder,Aina hyvät! Minulle Sloggi maxi sopii kuin valettu.Vyötarölle ylettyvä malli on järkevä.,5,https://www.prisma.fi/tuotteet/100086327/sloggi-maxi-basic-naisten-alushousut-3-pack-100086327,fi
placeholder,Hyvät jalassa. Ostan aina on kestävät ja joustaa.,5,https://www.prisma.fi/tuotteet/100086327/sloggi-maxi-basic-naisten-alushousut-3-pack-100086327,fi
placeholder,"Hyvä laatu. Malli ei sovi minulle ja koko ei vastannut muita käyttämäni alushousuja, mutta kangaslaatu vaikuttaa hyvältä. Lahjeaukon tulisi olla edestä laajempi ja vyötärön hieman korkeampi",2,https://www.prisma.fi/tuotteet/100086327/sloggi-maxi-basic-naisten-alushousut-3-pack-100086327,fi
placeholder,Laatua! Takuuvarmaa laatua vuodesta toiseen.,5,https://www.prisma.fi/tuotteet/100086327/sloggi-maxi-basic-naisten-alushousut-3-pack-100086327,fi
placeholder,kaikin puolin hyvä. materiaali tuntuu hyvältä ihoa vasten,4,https://www.prisma.fi/tuotteet/100086327/sloggi-maxi-basic-naisten-alushousut-3-pack-100086327,fi
placeholder,"Pese ja pidä. Sloggit pitävät kuosinsa ja värinsä pesusta pesuun. Pysyvät hyvin jalassa, eivätkä valu kovassakaan vauhdissa. Hinta ja laatu kohtaavat.",4,https://www.prisma.fi/tuotteet/100086327/sloggi-maxi-basic-naisten-alushousut-3-pack-100086327,fi
placeholder,Mahtavat istuvat. Olen käyttänyt aina mitapä sitä vaihtamaan hyväksi todettu,5,https://www.prisma.fi/tuotteet/100086327/sloggi-maxi-basic-naisten-alushousut-3-pack-100086327,fi
placeholder,Hyvät kaarteessa. Muuten hyvät mutta kivesten kohilta tiukat.,3,https://www.prisma.fi/tuotteet/100086327/sloggi-maxi-basic-naisten-alushousut-3-pack-100086327,fi
placeholder,"HYVÄN MALLISET SLOGGIT. Ostin muutama aika sitten sloggipaketin. Olen ollut tyytyväinen valintaani. Malleissa on eri korkuisia sloggeja, jokaiselle löytyy sopivat.",4,https://www.prisma.fi/tuotteet/100086327/sloggi-maxi-basic-naisten-alushousut-3-pack-100086327,fi
