otsikko,teksti,tahdet,url,kieli
placeholder,"Peruspopot talveen. Lämpimät ja helppo pukea. Olisin mieluummin ostanut lapselle istuvammat talvikengät, mutta mistään ei sellaisia löytynyt oikeaa kokoa. Kyllä nämä asiansa ajaa.",4,https://www.prisma.fi/tuotteet/100069896/kuoma-putkivarsi-lasten-talvisaappaat-koot-36-39-100069896,fi
placeholder,Kuoma ovat maailman helpoimmat kengät. Ostin pari viikkoa sitten lapselleni ja lapsi ei voisi olla tyytyväisempi. Sattu kovat pakkasetkin eikä palele varpaita ollenkaan.,4,https://www.prisma.fi/tuotteet/100069896/kuoma-putkivarsi-lasten-talvisaappaat-koot-36-39-100069896,fi
placeholder,"Mainiot jalkineet. Nämä nyt ostamani saappaat omat ovat jo toiset Kuomat! Jalkineet ovat lämpimät, mukavat jalalle ja helposti jalkaan vedettävät. Kestävät hyvin kulutusta ja kosteaa säätä.",1,https://www.prisma.fi/tuotteet/100069896/kuoma-putkivarsi-lasten-talvisaappaat-koot-36-39-100069896,fi
placeholder,Lämpöset ovat. Hyvät on jalat tarkenee eikä lipsu,5,https://www.prisma.fi/tuotteet/100069896/kuoma-putkivarsi-lasten-talvisaappaat-koot-36-39-100069896,fi
placeholder,"Täydellinen talvikenkä! Kuomat ovat palvelleet kaikkia perheenjäseniä taaperoiästä aikuisiin jo yli 10 vuoden ajan. Helpot ja nopeat laittaa jalkaan, ovat lämpimät ja säänkestävät. Ei loska ja vesi haittaa. Varma valinta erityisesti lapsiperheiden ulkoiluun ja kovaan käyttöön.",5,https://www.prisma.fi/tuotteet/100069896/kuoma-putkivarsi-lasten-talvisaappaat-koot-36-39-100069896,fi
placeholder,"Helppo pukea, lämmin ja kosteuden pitävä. Lapsen toiveesta lämpimät ja helpot saappaat. Mukava huomata että ei leudommalla kelilläkään heti kastu läpi vaan on jotain stoppia alaosassa pinnoitteena. Näistä on vielä talvikengiksi vaikka muuten jo pitää olla tietyn näköistä ja tyylistä.",5,https://www.prisma.fi/tuotteet/100069896/kuoma-putkivarsi-lasten-talvisaappaat-koot-36-39-100069896,fi
placeholder,Hyvin sujahtaa jalkaan ja lämpimät on. Kuukauden on hyvin palvelleet ❤️,4,https://www.prisma.fi/tuotteet/100069896/kuoma-putkivarsi-lasten-talvisaappaat-koot-36-39-100069896,fi
placeholder,Kuomat ovat hyvät jalassa. Lapsi on ollut tyytyväinen uusiin kuomakenkiin.,5,https://www.prisma.fi/tuotteet/100069896/kuoma-putkivarsi-lasten-talvisaappaat-koot-36-39-100069896,fi
placeholder,"Talven must -tuote. Kuomat ovat lämpimät, pitävät (eivät siis liukkaat), helpot pukea ja riisua, ja hinta-laatu -suhdekin on kohdillaan, eli aivan talven vaatekaapin perustuote.",5,https://www.prisma.fi/tuotteet/100069896/kuoma-putkivarsi-lasten-talvisaappaat-koot-36-39-100069896,fi
placeholder,"Lämpimät. Kuomat ovat mukavat ja lämpimät jalassa. Lapset tykkäävät, että ne on helppo pukea ja riisua. Mahtavaa on myös se, että ne on kotimaista tekoa.",5,https://www.prisma.fi/tuotteet/100069896/kuoma-putkivarsi-lasten-talvisaappaat-koot-36-39-100069896,fi
placeholder,Hyvät jaloissa! Ostin nämä pari kuukautta sitten ja ovat todella hyvät ja napakat jaloissa eikä taatusti varpaita palele!,5,https://www.prisma.fi/tuotteet/100069896/kuoma-putkivarsi-lasten-talvisaappaat-koot-36-39-100069896,fi
placeholder,"Mahtavat ominaisuudet! Ostin nämä kuoma saappaat noin kuukausi sitten ja olen ollut todella tyytyväinen, ovat tosi lämpimät.",5,https://www.prisma.fi/tuotteet/100069896/kuoma-putkivarsi-lasten-talvisaappaat-koot-36-39-100069896,fi
placeholder,"Lämpimät kengät, joita ostettu vuosia lapsille. Helpot kengät lasten laittaa itse jalkaan. Isommilla lapsilla kantapään kohdalta takaa vuori rikkoutuu nopeasti.",3,https://www.prisma.fi/tuotteet/100069896/kuoma-putkivarsi-lasten-talvisaappaat-koot-36-39-100069896,fi
placeholder,Hyvät. Palaute käyttäjältä: on oikein hyvät,4,https://www.prisma.fi/tuotteet/100069896/kuoma-putkivarsi-lasten-talvisaappaat-koot-36-39-100069896,fi
placeholder,Hyvin toimii. Hyvin toimii ja hyvät jalassa. Lämpimät.,5,https://www.prisma.fi/tuotteet/100069896/kuoma-putkivarsi-lasten-talvisaappaat-koot-36-39-100069896,fi
placeholder,Lapselle lämpimät. Lapsille ostan lähes joka vuosi Kuomat talveksi. Välillä on muitakin kenkiä mutta näihin palataan aina kun oikeat pakkaset alkaa.,4,https://www.prisma.fi/tuotteet/100069896/kuoma-putkivarsi-lasten-talvisaappaat-koot-36-39-100069896,fi
placeholder,Talvikenkä jonka laatu ei petä! Loistavat vuodesta toiseen ja vauvasta mummiin. Menee joka märemmälläkin säällä. Vaihtuvat kuosit piristävät vuosittain.,5,https://www.prisma.fi/tuotteet/100069896/kuoma-putkivarsi-lasten-talvisaappaat-koot-36-39-100069896,fi
placeholder,Parhaat talvikengät. Ostin nämä pojalleni ja hänen mielestään parhaat talvikengät lämpöiset ja mukavat.,5,https://www.prisma.fi/tuotteet/100069896/kuoma-putkivarsi-lasten-talvisaappaat-koot-36-39-100069896,fi
placeholder,hyvät perus muksun talvisaappat. Kuukauden on ainakin kestänyt Ranskassa käytössä. Varmaan pärjää tämän talven.,4,https://www.prisma.fi/tuotteet/100069896/kuoma-putkivarsi-lasten-talvisaappaat-koot-36-39-100069896,fi
placeholder,"Aina tarpeelliset. Kyllä, olen tyytyväinen. Kevyet ja lämpimät.",5,https://www.prisma.fi/tuotteet/100069896/kuoma-putkivarsi-lasten-talvisaappaat-koot-36-39-100069896,fi
placeholder,"Hyvä talvisaapas. Erittäin lämmin talvisaapas. Kivat kuosit, joista lapsi saa valita itselleen mieleiset. Hyvä varvastila. Helppo sovittaa oikea koko, kun pohjallinen lähtee irti. Lapsi tykkää.",5,https://www.prisma.fi/tuotteet/100069896/kuoma-putkivarsi-lasten-talvisaappaat-koot-36-39-100069896,fi
placeholder,"Kuomat, lasten parhaat talvikengät. Erittäin tyytyväisiä käyttäjiä meillä kuomakengillä",5,https://www.prisma.fi/tuotteet/100069896/kuoma-putkivarsi-lasten-talvisaappaat-koot-36-39-100069896,fi
placeholder,Parhaat talvikengät. Toimii niin hyvin lämpöisen vuoren ansiosta.,5,https://www.prisma.fi/tuotteet/100069896/kuoma-putkivarsi-lasten-talvisaappaat-koot-36-39-100069896,fi
placeholder,"Erittäin hyvät talvijalkineet. Ostin nämä kengät tyttärelle,koska ne on koettu lämpimiksi ja kestäviksi vuodesta toiseen.",5,https://www.prisma.fi/tuotteet/100069896/kuoma-putkivarsi-lasten-talvisaappaat-koot-36-39-100069896,fi
placeholder,parhaat saappaat. Ostin tämän kuukausi sitten ja olen ollut tyytyväinen,5,https://www.prisma.fi/tuotteet/100069896/kuoma-putkivarsi-lasten-talvisaappaat-koot-36-39-100069896,fi
placeholder,Mahtavat ominaisuudet. Ostan niitä jo 2 vuotta. Olen tyytyväinen. Mukavat ja lämmintä,5,https://www.prisma.fi/tuotteet/100069896/kuoma-putkivarsi-lasten-talvisaappaat-koot-36-39-100069896,fi
placeholder,Hyvät saappaat. Poika on tyytyväinen saappaisiin.,4,https://www.prisma.fi/tuotteet/100069896/kuoma-putkivarsi-lasten-talvisaappaat-koot-36-39-100069896,fi
placeholder,Mukavat jalassa. Helppo laittaa jalkaan ja lämpimät. Kevyet.,5,https://www.prisma.fi/tuotteet/100069896/kuoma-putkivarsi-lasten-talvisaappaat-koot-36-39-100069896,fi
placeholder,"Luotto talvikengät vuodesta toiseen. Lämpimät, kestävät kengät!",5,https://www.prisma.fi/tuotteet/100069896/kuoma-putkivarsi-lasten-talvisaappaat-koot-36-39-100069896,fi
placeholder,"Paras talvikenkä lapselle. Kolmen lapsen äitinä olen todennut,että kuomat on ehdottomasti paras talvijalkine lapselle suomen talveen. Näillä pärjää niin loskassa kun pakkasella. Hyvä hintalaatusuhde. Suosittelen!",5,https://www.prisma.fi/tuotteet/100069896/kuoma-putkivarsi-lasten-talvisaappaat-koot-36-39-100069896,fi
placeholder,Oikein hyvät ja lämpöiset kengät. Ostettiin lapselle kyseiset kengät. Sekä lapsi että vanhemmat ollaan tyytyväisiä.,5,https://www.prisma.fi/tuotteet/100069896/kuoma-putkivarsi-lasten-talvisaappaat-koot-36-39-100069896,fi
placeholder,"Hyvä kenkä, tytär tykkää. Hyvin on lämpimät ja mukavat jalassa",5,https://www.prisma.fi/tuotteet/100069896/kuoma-putkivarsi-lasten-talvisaappaat-koot-36-39-100069896,fi
placeholder,Ok talvikenkä. Poika tykkää. Helppo laittaa jalkaan. Kapeahko lesti,4,https://www.prisma.fi/tuotteet/100069896/kuoma-putkivarsi-lasten-talvisaappaat-koot-36-39-100069896,fi
placeholder,"Upeat jalassa. Lapsenlapsille olen ostanut vuosittain Kuoma kengiä ja tykkäävät , ovat lämpimät ja sopii hyvin jalalle,, joka tavalla upeat kengät",5,https://www.prisma.fi/tuotteet/100069896/kuoma-putkivarsi-lasten-talvisaappaat-koot-36-39-100069896,fi
placeholder,Luotettavaa Kuoma laatua. Kuomat on lämpimät ja hintalaatusuhde kohdallaan.,4,https://www.prisma.fi/tuotteet/100069896/kuoma-putkivarsi-lasten-talvisaappaat-koot-36-39-100069896,fi
placeholder,"Parhaat jokakelin talvikengät lapselle! Ostettiin ajoissa kuukausi sitten uudet Kuomat talvikengiksi lapselle. Hyvät talvikengät joka kelillä. Leveä malli, joten mahtuu lämpimät sukat kenkään.",5,https://www.prisma.fi/tuotteet/100069896/kuoma-putkivarsi-lasten-talvisaappaat-koot-36-39-100069896,fi
placeholder,"Luotettavat talvikengät. Kyllä Kuomat on suomessa asuvalle lapselle tarpeelliset. Kuomat on lämpimät ja kestävät kengät, malli on riittävän reilu, että jalkaan sopii ne mummon 7-veljestä langasta neulomat villasukat. Hinta-laatu suhde on erinomainen.",5,https://www.prisma.fi/tuotteet/100069896/kuoma-putkivarsi-lasten-talvisaappaat-koot-36-39-100069896,fi
placeholder,"Hyvin toimii. Peruskäyttöön lapselle, hyvin toimii ja kestää. Pitää jalat lämpiminä.",5,https://www.prisma.fi/tuotteet/100069896/kuoma-putkivarsi-lasten-talvisaappaat-koot-36-39-100069896,fi
placeholder,Takuuvarmasti jalat pysyvät lämpiminä. Useammat jo hankittu,5,https://www.prisma.fi/tuotteet/100069896/kuoma-putkivarsi-lasten-talvisaappaat-koot-36-39-100069896,fi
placeholder,Hyvät kengät! Olen tyytyväinen ostokseen. Olen monena vuonna ostanut kuomat ja lapsi tykkää pitää niitä. Ne on helppo pukea.,5,https://www.prisma.fi/tuotteet/100069896/kuoma-putkivarsi-lasten-talvisaappaat-koot-36-39-100069896,fi
placeholder,Ominaisuudet. Noin kuukausi sitten ostin nämä,4,https://www.prisma.fi/tuotteet/100069896/kuoma-putkivarsi-lasten-talvisaappaat-koot-36-39-100069896,fi
placeholder,Kuomat. Paras kenkä lumisäässä koko perheelle.,5,https://www.prisma.fi/tuotteet/100069896/kuoma-putkivarsi-lasten-talvisaappaat-koot-36-39-100069896,fi
placeholder,"Helppous. Nopeat sujauttaa jalkaa, ei nauhoja yms.. jalat pysyy lämpöisinä ja vielä Suomalainen tuote!",5,https://www.prisma.fi/tuotteet/100069896/kuoma-putkivarsi-lasten-talvisaappaat-koot-36-39-100069896,fi
placeholder,Kyllä ovat hyvät . Kyllä olen tyytyvöinen,5,https://www.prisma.fi/tuotteet/100069896/kuoma-putkivarsi-lasten-talvisaappaat-koot-36-39-100069896,fi
placeholder,Kuomat toimii aina! Hyvät ja lämpöiset talvijalkineet!,5,https://www.prisma.fi/tuotteet/100069896/kuoma-putkivarsi-lasten-talvisaappaat-koot-36-39-100069896,fi
placeholder,"Perus Kuomat. Vanhat kunnon kuomat lapselle pakkaspäiviin. Tosi lämpimät, aivan eri luokkaa kuin kapeakärkiset ja istuvammat Vikingit yms. Toisaalta ei niin hyvät pallopeleihin tms. aktiiviseen menoon. Ei parhaimillaan loskakeleillä, koska eivät ole vedenpitävät.",4,https://www.prisma.fi/tuotteet/100069896/kuoma-putkivarsi-lasten-talvisaappaat-koot-36-39-100069896,fi
placeholder,Kuomat ovat parhaat ! Jälleen on Kuomat ostettu kummipojalle - takuuvarma valinta jo vuosien ajan kaikille lapsille. Nyt on alkanut kiinnostaa että kokeilisinko itsellenikin … mahdollinen voitto arvonnassa mahdollistaisi sen.,5,https://www.prisma.fi/tuotteet/100069896/kuoma-putkivarsi-lasten-talvisaappaat-koot-36-39-100069896,fi
placeholder,Lämpimät jalkineet. Ostin nämä muutama viikko sitten ja lapsi on ollut tyytyväinen ja jalat ovat pysyneet lämpiminä myös kovalla pakkasella,4,https://www.prisma.fi/tuotteet/100069896/kuoma-putkivarsi-lasten-talvisaappaat-koot-36-39-100069896,fi
placeholder,Parhaat jalkineet. Ostin mummolle. Helpot laittaa jalkaan. Ovat lämpöiset mummon kylmässä mökissä.,5,https://www.prisma.fi/tuotteet/100069896/kuoma-putkivarsi-lasten-talvisaappaat-koot-36-39-100069896,fi
placeholder,"Tyytyväinen asiakas. Kengät palvelevat pieniä varpaita loistavasti, ne lämpiminä pitäen.",5,https://www.prisma.fi/tuotteet/100069896/kuoma-putkivarsi-lasten-talvisaappaat-koot-36-39-100069896,fi
placeholder,"Helppo ja toimiva. Paras talvikenkä lapselle: helppo nykäistä jalkaan, voi kahlata lumessa, varsi sopii haalarinlahkeen sisälle ja villasukkakin mahtuu. Ei muut talvikengät edes kelpaa lapsille, kun ovat Kuomiin tottuneet...",5,https://www.prisma.fi/tuotteet/100069896/kuoma-putkivarsi-lasten-talvisaappaat-koot-36-39-100069896,fi
placeholder,"Lämpimät mutta hiostavat. Saappaat tuntuvat mukavilta ja sisältä pörröisiltä. Jalat kuitenkin hikoilevat paljon. Kärkiosa pitää hyvin vettä, mutta jalkapöydän päältä päästävät vettä - eivät sovi lätäkköhyppelyyn! Kuukauden käytön jälkeen näyttävät vielä melkein uusilta.",4,https://www.prisma.fi/tuotteet/100069896/kuoma-putkivarsi-lasten-talvisaappaat-koot-36-39-100069896,fi
placeholder,"Huonolaatuiset. Vasemmassa kengässä oli ulkoreunan sisäpuolella paksu kohta(ommelvirhe), joka painoi kävellessä.Kengät lähtivät palautukseen.Pettynyt olen tällaiseen laatuun.Kestääkö näissä pohjakaan kauaa, murenevaa matskua.Kertokaahan kommenttia pohjan kestävyydestä.",1,https://www.prisma.fi/tuotteet/100069896/kuoma-putkivarsi-lasten-talvisaappaat-koot-36-39-100069896,fi
placeholder,Hyvät lasten kuomakengät. Kuomat ovat helpot monensään jalkineet. Lämpimät ja nopeat pukea. Hintalaatusuhde kohdillaan.,4,https://www.prisma.fi/tuotteet/100069896/kuoma-putkivarsi-lasten-talvisaappaat-koot-36-39-100069896,fi
placeholder,Tyttäreltä äidille super-jalkineet! Pohjamateriaali erityisen pitävä loistavalla kelillä.,5,https://www.prisma.fi/tuotteet/100069896/kuoma-putkivarsi-lasten-talvisaappaat-koot-36-39-100069896,fi
placeholder,Hyvät saappaat! Kestävät ja lämpimät.,5,https://www.prisma.fi/tuotteet/100069896/kuoma-putkivarsi-lasten-talvisaappaat-koot-36-39-100069896,fi
placeholder,"Aina laadukkaat. Olemme ostaneet kuomat lapsellemme joka talvi, ne ovat aina varma valinta. Hyvät, kestävät talvisaappaat ja helppo laittaa jalkaan.",5,https://www.prisma.fi/tuotteet/100069896/kuoma-putkivarsi-lasten-talvisaappaat-koot-36-39-100069896,fi
placeholder,Hyvät saappaat. Meillä jo useat Luomat käytössä lapsilla edelleen hyvät ja helpot käyttää.,5,https://www.prisma.fi/tuotteet/100069896/kuoma-putkivarsi-lasten-talvisaappaat-koot-36-39-100069896,fi
placeholder,"Tuttua Kuoma-laatua. Neljännet Kuomat menossa - edelliset kun jäävät pieneksi, ostan uudet isommat tilalle. Lämpimät, helppokäyttöiset ja hyvät. Ei tarvetta vaihtaa merkkiä!",5,https://www.prisma.fi/tuotteet/100069896/kuoma-putkivarsi-lasten-talvisaappaat-koot-36-39-100069896,fi
placeholder,Takuuvarmat kuomat. Ostin kuomat pojalleni kuukausi sitten ja hän ei ole sen jälkeen suostunut enää laittamaan muita kenkiä kouluun. On lämpimät ja varmasti mukavat jalassa.,5,https://www.prisma.fi/tuotteet/100069896/kuoma-putkivarsi-lasten-talvisaappaat-koot-36-39-100069896,fi
placeholder,Joka talvinen ostos. Lapsella on ollut Kuomat käytössä joka talvi. Lapsen on ollut helppo laittaa itse kengät jalkaan pienestä pitäen. Kovemmilla pakkasilla lisänä villasukat ja varpaat ovat pysyneet lämpiminä.,5,https://www.prisma.fi/tuotteet/100069896/kuoma-putkivarsi-lasten-talvisaappaat-koot-36-39-100069896,fi
placeholder,"Kuomat. Ihanat kuomat, ainoat kengät joissa jalat pysyy lämpimänä.",5,https://www.prisma.fi/tuotteet/100069896/kuoma-putkivarsi-lasten-talvisaappaat-koot-36-39-100069896,fi
placeholder,"Laatua lapsille. Erittäin hyvät, lämpimät ja kestävät!",5,https://www.prisma.fi/tuotteet/100069896/kuoma-putkivarsi-lasten-talvisaappaat-koot-36-39-100069896,fi
placeholder,Lämpimät ja kestävät. Perheessämme on ollut käytössä jo monet Kuoman jalkineet ja ollaan oltu niihin erittäin tyytyväisiä. Niissä ei jalat palele ja ovat melko kestävätkin. Hinta ja laatu kohtaavat hyvin.,5,https://www.prisma.fi/tuotteet/100069896/kuoma-putkivarsi-lasten-talvisaappaat-koot-36-39-100069896,fi
placeholder,"Parhaat talvijalkineet. Kuomat eivät petä - lämpimät, vedenpitävät, mukavat jalassa.",5,https://www.prisma.fi/tuotteet/100069896/kuoma-putkivarsi-lasten-talvisaappaat-koot-36-39-100069896,fi
placeholder,"Helpot pukea. On jo toiset Kuomat, tukevat, lämpimät ja helpot pukea",5,https://www.prisma.fi/tuotteet/100069896/kuoma-putkivarsi-lasten-talvisaappaat-koot-36-39-100069896,fi
placeholder,"Hinta-laatusuhde erinomainen. Lämpimät, Suomessa valmistetut.",5,https://www.prisma.fi/tuotteet/100069896/kuoma-putkivarsi-lasten-talvisaappaat-koot-36-39-100069896,fi
placeholder,Parhaat talvikengät lapselle. 19 vuotta sitten musta tuli ekan kerran äiti. Kolme poikaa. Ja jokainen on käyttänyt kuomia monia vuosia aina esiteini ikään. Nyt nuorin 8v ja joka vuosi edelleen ostan kuomat. Pitää jalat lämpösinä ja pitää myös vettä jonkin verran.,5,https://www.prisma.fi/tuotteet/100069896/kuoma-putkivarsi-lasten-talvisaappaat-koot-36-39-100069896,fi
placeholder,"Lämmin ja kevyt saappaat, mukava jaloissa ole. Ostin kuukauden sitten ja olen tosi tyytyväinen",5,https://www.prisma.fi/tuotteet/100069896/kuoma-putkivarsi-lasten-talvisaappaat-koot-36-39-100069896,fi
placeholder,"Luultavasti hyvät?. Vielä en tiedä kun ei ole olleet käytössä, lämmin syksy. Mut entuudesta tiedän että hyvät.",5,https://www.prisma.fi/tuotteet/100069896/kuoma-putkivarsi-lasten-talvisaappaat-koot-36-39-100069896,fi
placeholder,Paras talvijalkine. Tähän tuotteeseen en pysty vielä vastaamaan.Olen kuoma jalkineen suurkuluttaja joten mulla on ollut niitä paljon ja olen aina ihmetellyt että miksi pohja murenee päkiän kohdalta ja siten jalkine ei ole vesitiivis enää.Muuten ihan lämmin ja mukava.,5,https://www.prisma.fi/tuotteet/100069896/kuoma-putkivarsi-lasten-talvisaappaat-koot-36-39-100069896,fi
placeholder,Kuomat. Kestosuosikit vuodesta toiseen,4,https://www.prisma.fi/tuotteet/100069896/kuoma-putkivarsi-lasten-talvisaappaat-koot-36-39-100069896,fi
placeholder,Pettämätön valinta. Jalat pysyy lämpimänä eikä lumi pääse nilkkoihin. Ajaton peruskenkä koko perheelle.,5,https://www.prisma.fi/tuotteet/100069896/kuoma-putkivarsi-lasten-talvisaappaat-koot-36-39-100069896,fi
placeholder,"Erinomainen ostos! Kuoman talvikengät ovat laadukkaat, helpot laittaa jalkaan ja pitävät jalat lämpiminä talven pakkaskeleillä.",5,https://www.prisma.fi/tuotteet/100069896/kuoma-putkivarsi-lasten-talvisaappaat-koot-36-39-100069896,fi
placeholder,Erittäin hyvät talvijalkineet. Perheessä ollut käytössä vuosikausia. Hyviksi havaitut.,5,https://www.prisma.fi/tuotteet/100069896/kuoma-putkivarsi-lasten-talvisaappaat-koot-36-39-100069896,fi
placeholder,On hyvät ja lämpimät. Olen ollut tyytyväinen tuotteeseen,4,https://www.prisma.fi/tuotteet/100069896/kuoma-putkivarsi-lasten-talvisaappaat-koot-36-39-100069896,fi
placeholder,Klassinen malli. Tämä sopii erilaisiin kattauksiin.,4,https://www.prisma.fi/tuotteet/100057204/iittala-syva-lautanen-teema-21-cm-valkoinen-100057204,fi
placeholder,"Iittala Teema syvä lautanen. Lautanen on aika iso, mutta erinomainen pastalautanen",4,https://www.prisma.fi/tuotteet/100057204/iittala-syva-lautanen-teema-21-cm-valkoinen-100057204,fi
placeholder,Huippu hyvä. Ostamani tuote on ollut oikein hyvä,5,https://www.prisma.fi/tuotteet/100057204/iittala-syva-lautanen-teema-21-cm-valkoinen-100057204,fi
placeholder,"Paras syvä lautanen. Ostin nämä kaksi aikaisempien neljän lautasen lisäksi, koska ovat erittäin hyviä keitto- ja puurolautasiksi. Ovat sopivan tilavia ja helppoja puhdistaa sekä myös kestäviä. Olen vienyt tyttärelleni näitä myös Ruotsiin ja hänkin on erittäin tyytyväinen näihin.",5,https://www.prisma.fi/tuotteet/100057204/iittala-syva-lautanen-teema-21-cm-valkoinen-100057204,fi
placeholder,"Perusvarmaa. Hieman ehkä tylsähköt, mutta kuitenkin toimivat ja ajattomat lautaset, jotka käyvät moneen. Omaan käyttöön juuri sopivankokoisetkin",4,https://www.prisma.fi/tuotteet/100057204/iittala-syva-lautanen-teema-21-cm-valkoinen-100057204,fi
placeholder,Sopivan kokoinen. Olen ollut tyytyväinen,4,https://www.prisma.fi/tuotteet/100057204/iittala-syva-lautanen-teema-21-cm-valkoinen-100057204,fi
placeholder,"Sopii moneen kattasukseen. Tyylikäs, helpo yhdistää muihin, hyvö koko, hyvä laatu",5,https://www.prisma.fi/tuotteet/100057204/iittala-syva-lautanen-teema-21-cm-valkoinen-100057204,fi
placeholder,"Nämä Teema lautaset ovat parhaat! Minulla oli näit. lautasia jo aiemmin, hankin niitä nyt lisää.",5,https://www.prisma.fi/tuotteet/100057204/iittala-syva-lautanen-teema-21-cm-valkoinen-100057204,fi
placeholder,"TARPEEKSI ISO KEITOLLE JA VOI KÄYTTÄÄ MYÖS PASTALL. Ostin rippilahjaksi, mutta itselläni on myös ko lautasia",4,https://www.prisma.fi/tuotteet/100057204/iittala-syva-lautanen-teema-21-cm-valkoinen-100057204,fi
placeholder,Monipuolinen ja kaunis astia! Etsinyt pitkään syviä lautasia/kulhoja joita voisi käyttää mm.kulhoruokiin ja salaatteihin joita paljon syön. Nämä ovat niihin ihan täydelliset ja näistä tuli lempilautaset heti. Ovat todella monipuoliset käyttää ja yksinkertaisen kauniit ja laadukkaat.,5,https://www.prisma.fi/tuotteet/100057204/iittala-syva-lautanen-teema-21-cm-valkoinen-100057204,fi
placeholder,"Ajaton muotoilu. Täydensin lautasvalikoimaani, johon olen tyytyväinen, valikoimastani löytyy myös 70-luvulla ostettuja lautasia, silloin Kilta-nimisiä, astiat ovat yhteensopivia",4,https://www.prisma.fi/tuotteet/100057204/iittala-syva-lautanen-teema-21-cm-valkoinen-100057204,fi
placeholder,Todella hyvä. Olen ollut erittäin tyytyväinen tuotteeseen,5,https://www.prisma.fi/tuotteet/100057204/iittala-syva-lautanen-teema-21-cm-valkoinen-100057204,fi
placeholder,Toimii hyvin astianpesukoneessa. Täydensin entisten määrää,4,https://www.prisma.fi/tuotteet/100057204/iittala-syva-lautanen-teema-21-cm-valkoinen-100057204,fi
placeholder,Kivan näköinen. Tosi kiva perus lautanen arki käyttöön!,5,https://www.prisma.fi/tuotteet/100057204/iittala-syva-lautanen-teema-21-cm-valkoinen-100057204,fi
placeholder,"Joka tilanteeseen sopiva. Kestävää, kotimaista muotoilua.",5,https://www.prisma.fi/tuotteet/100057204/iittala-syva-lautanen-teema-21-cm-valkoinen-100057204,fi
placeholder,"Perushyvä lautanen. Kestävä ja tyylikäs, yksinkertainen muotoilu",4,https://www.prisma.fi/tuotteet/100057204/iittala-syva-lautanen-teema-21-cm-valkoinen-100057204,fi
placeholder,"näyttävän ajaton. Olen nyt kuukauden saanut näitä käyttää, ja olen tyytyväinen. Muotoilu on todella käytännöllinen. Näitä voi käyttää niin arjessa kuin juhlassakin. Eivätkä ole edes kalliita.",4,https://www.prisma.fi/tuotteet/100057204/iittala-syva-lautanen-teema-21-cm-valkoinen-100057204,fi
placeholder,Hieno lautanen. Hieno ja laadukas. Pinta on kova ja kiiltävä.,5,https://www.prisma.fi/tuotteet/100057204/iittala-syva-lautanen-teema-21-cm-valkoinen-100057204,fi
placeholder,Yllättänyt täydellisyydellään. Ostin keväällä ja kyllä on käyttöä ollut!,5,https://www.prisma.fi/tuotteet/100057204/iittala-syva-lautanen-teema-21-cm-valkoinen-100057204,fi
placeholder,"Hyvä muotoilu,käytännöllinen. Hyvä valinta. Laadukas ,tyylikäs muotoilu..",5,https://www.prisma.fi/tuotteet/100057204/iittala-syva-lautanen-teema-21-cm-valkoinen-100057204,fi
placeholder,Ajaton lautanen. Sopii niin arki-kuin juhlakattaukseen.,5,https://www.prisma.fi/tuotteet/100057204/iittala-syva-lautanen-teema-21-cm-valkoinen-100057204,fi
placeholder,"Hyvä tuote. Hyvä lahja siskolle, tykkäsi kovasti. Itsekin voisin ostaa itselleni",5,https://www.prisma.fi/tuotteet/100057204/iittala-syva-lautanen-teema-21-cm-valkoinen-100057204,fi
placeholder,Kunnon syvä soppalautanen. Olen tyytyväinen ostokseen.,5,https://www.prisma.fi/tuotteet/100057204/iittala-syva-lautanen-teema-21-cm-valkoinen-100057204,fi
placeholder,Laadukas ja kestävä tuote. Suomalaista laatua ja meillä on ennestään samaa sarjaa,5,https://www.prisma.fi/tuotteet/100057204/iittala-syva-lautanen-teema-21-cm-valkoinen-100057204,fi
placeholder,"Valkoinen syvä teemalautanen. Klassinen, sopii yhdisteltäväksi moneen sarjaan.",4,https://www.prisma.fi/tuotteet/100057204/iittala-syva-lautanen-teema-21-cm-valkoinen-100057204,fi
placeholder,Mahtava tuote. Tyytyväinen olen hankintaan,5,https://www.prisma.fi/tuotteet/100057204/iittala-syva-lautanen-teema-21-cm-valkoinen-100057204,fi
placeholder,"Todella hyvä. Olen tyytyväinen, täydentää aikaisemmin ostamaani sarjaa.",4,https://www.prisma.fi/tuotteet/100057204/iittala-syva-lautanen-teema-21-cm-valkoinen-100057204,fi
placeholder,Puuro&Pasta. Hyvä lautanen niin puurolle kuin pastallekin,5,https://www.prisma.fi/tuotteet/100057204/iittala-syva-lautanen-teema-21-cm-valkoinen-100057204,fi
placeholder,Mahtava. Olen ollut tyytyväinen tähän tuotteeseen!,5,https://www.prisma.fi/tuotteet/100057204/iittala-syva-lautanen-teema-21-cm-valkoinen-100057204,fi
placeholder,"Hyvä peruslautanen. Käytössä päivittäin, kestää käyttöä.",4,https://www.prisma.fi/tuotteet/100057204/iittala-syva-lautanen-teema-21-cm-valkoinen-100057204,fi
placeholder,"Varma klassikko. Ostin näitä klassikoita häälahjaksi kaverille. Nämä ei petä koskaan! (Paitsi keiton määrän arvioinnissa lautasella, sillä nämä on niin isot ja syvät)",5,https://www.prisma.fi/tuotteet/100057204/iittala-syva-lautanen-teema-21-cm-valkoinen-100057204,fi
