otsikko,teksti,tahdet,url,kieli
placeholder,"Laatu huonontunut aiemmasta. Musta sloggi tai-malliset ovat olleet luottohousut jo 20 vuoden ajan ja ostan uusia muutaman kk välein ja nyt yhtäkkiä tässä satsissa kuminauhat vyötäröllä ovat lyhyemmät ja joustamattomammat kuin aiemmin, joten eipä olleet yhtään mukavat päällä, kun puristaa liikaa. Koko sama useamman vuoden ja edelliset muutamaa kk aiemmin ostetut ovat saman kokoiset mutta niissä kuminauha on vielä mukava eikä kiristä. Kangas on huonontunut jo useampi vuosi sitten, mutta jos tuo kuminauha-ongelma jatkuu tulevissakin ostoksissa, niin lopetan näiden ostamisen. Nyt on säästetty huonossa paikassa - toivottavasti tässä on jokin erävirhe vain.",3,https://www.prisma.fi/tuotteet/100086329/sloggi-tai-basic-naisten-alushousut-3-pack-100086329,fi
placeholder,"Edullinen ostos kolmen pakkauksessa. Olen käyttänyt Sloggeja ainakin parikymmentä vuotta. Aiemmin käyttämissäni Tai Romance -mallissa vaihtui erilainen vyötärönauha ja se oli kapea ja kovan tuntuinen. Ostin kokeeksi Tai Basic mallisia housuja kolmen kappaleen pakkausessa: Niissä vyötärönauha on leveä ja miellyttävän tuntuinen. Ovat pysyneet pesussa hyvinä. Kannattaa ostaa omaa numeroa yhden numeron isommat, niin saumat kestävät paremmin. Yleensä pesussa puuvilla kutistuu vähän.",4,https://www.prisma.fi/tuotteet/100086329/sloggi-tai-basic-naisten-alushousut-3-pack-100086329,fi
placeholder,Pitkäaikainen Sloggi Tai käyttäjä. Hinta/laatusuhde heikentynyt aikaisemmista vuosista. Kestävät huomattavasti vähemmän aikaa. Vyötärön sivuista joko sormet menee kankaasta läpi tai sivusaumat pettävät.,3,https://www.prisma.fi/tuotteet/100086329/sloggi-tai-basic-naisten-alushousut-3-pack-100086329,fi
placeholder,"Parhaat alushousut. Olen käyttänyt varmaan yli 20 vuotta. Kestävät, mukavat käytössä, hinta-laatusuhde erinomainen.",5,https://www.prisma.fi/tuotteet/100086329/sloggi-tai-basic-naisten-alushousut-3-pack-100086329,fi
placeholder,"mahtavat ominaisuudet. Olen käyttänyt näitä tuotteita vuosien ajan. Alushousut ovat miellyttävät käyttää, puuvilla tuntuu aina hyvältä iholla, istuvat hyvin. Kestävät hyvin useita,useita pesukertoja.",5,https://www.prisma.fi/tuotteet/100086329/sloggi-tai-basic-naisten-alushousut-3-pack-100086329,fi
placeholder,"Hyvät perusalushousut. Varma ostos, tuote juuri kuten oletin",3,https://www.prisma.fi/tuotteet/100086329/sloggi-tai-basic-naisten-alushousut-3-pack-100086329,fi
placeholder,"Ihanat jalassa. Olen ostanut jo pidempään Sloggi alushousuja, kestää pesua hyvin mielyttävät jalassa",5,https://www.prisma.fi/tuotteet/100086329/sloggi-tai-basic-naisten-alushousut-3-pack-100086329,fi
placeholder,Hyvän malliset pikkarit. Ostin taas taattua laatua ja olen ollut tyytyväinen.,5,https://www.prisma.fi/tuotteet/100086329/sloggi-tai-basic-naisten-alushousut-3-pack-100086329,fi
placeholder,"Sloggi tai alushousut. Olen ostanut useampia alushousuja. Mukavat käyttää, ei paina eikä rullaudu. Pesussa pitää hyvin muotonsa.",4,https://www.prisma.fi/tuotteet/100086329/sloggi-tai-basic-naisten-alushousut-3-pack-100086329,fi
placeholder,Hyvä tuote. Alushousuja on miellyttävä käyttää. Ne voi pestä 90 asteisessa pesuohjelmassa.,5,https://www.prisma.fi/tuotteet/100086329/sloggi-tai-basic-naisten-alushousut-3-pack-100086329,fi
placeholder,Hyvä tuote. Olen tosi tyytyväinen hankintaan.,5,https://www.prisma.fi/tuotteet/100086329/sloggi-tai-basic-naisten-alushousut-3-pack-100086329,fi
placeholder,Hyvät pökät. Olen ostamaani alushousuihin todella tyytyväinen,5,https://www.prisma.fi/tuotteet/100086329/sloggi-tai-basic-naisten-alushousut-3-pack-100086329,fi
placeholder,Tärkeä osa pukeutumista. Luottoalushousut vuodesta toiseen.,5,https://www.prisma.fi/tuotteet/100086329/sloggi-tai-basic-naisten-alushousut-3-pack-100086329,fi
placeholder,Hyvät housut. Tosi slay eli teinin mielestä oikein hyvät.,4,https://www.prisma.fi/tuotteet/100086329/sloggi-tai-basic-naisten-alushousut-3-pack-100086329,fi
placeholder,"Täydelliset alushousut! Täydelliset alushousut arkikäyttöön ja liikuntaan! Istuvat hyvin, eivät hankaa, eivätä mene ryppyyn. Helppo pestä ja pitää puhtaana. Suosittelen!",5,https://www.prisma.fi/tuotteet/100086329/sloggi-tai-basic-naisten-alushousut-3-pack-100086329,fi
placeholder,Loistavaa peruslaatua! Aina hyvät perusalushousut. Kestää pitkään ja istuu hyvin.,5,https://www.prisma.fi/tuotteet/100086329/sloggi-tai-basic-naisten-alushousut-3-pack-100086329,fi
placeholder,"Pöksyt. Perusalushousut, minusta tuote on aikaisemmin ollut pehmeämpää puuvillaa. Edullisempi kolmen paketissa.",4,https://www.prisma.fi/tuotteet/100086329/sloggi-tai-basic-naisten-alushousut-3-pack-100086329,fi
placeholder,"Pettymys! Minulle luvattiin, että Sloggy Tai valkoisia alushousuja tulisi Tampereentien Prismaan taas. Eipä tullut! Eilen en ainakaan löytänyt! Nyt alla kysytään, suosittelenko tuotetta:kyllä jos sitä olisi myynnissä! Koomista!! Laitan tämän vuoksi alla olevaan keskiarvon.",1,https://www.prisma.fi/tuotteet/100086329/sloggi-tai-basic-naisten-alushousut-3-pack-100086329,fi
placeholder,Istuvuus hyvä. Kestää pesusta pesuun. Tuttu merkki. Näitä tulee ostettua pari kertaa vuodessa.,5,https://www.prisma.fi/tuotteet/100086329/sloggi-tai-basic-naisten-alushousut-3-pack-100086329,fi
placeholder,Sloggi tai pöksyt. Olen tyytyväinen ostokseeni.,5,https://www.prisma.fi/tuotteet/100086329/sloggi-tai-basic-naisten-alushousut-3-pack-100086329,fi
placeholder,Perushyvät. Olen jo pidempään käyttänyt perusalushousuina.,4,https://www.prisma.fi/tuotteet/100086329/sloggi-tai-basic-naisten-alushousut-3-pack-100086329,fi
placeholder,Perus housut. Perus hyvät käyttö housut,3,https://www.prisma.fi/tuotteet/100086329/sloggi-tai-basic-naisten-alushousut-3-pack-100086329,fi
placeholder,Hyvä materiaali. Materiaali on miellyttävä iholla ja housut ovat kestävät. Olen ostanut niitä aikaisemminkin. Lisäksi puuvillaisia alushousuja on vaikea enää löytää.,4,https://www.prisma.fi/tuotteet/100086329/sloggi-tai-basic-naisten-alushousut-3-pack-100086329,fi
placeholder,Kestävyys. Pitää kuosinsa pesusta pesuun,5,https://www.prisma.fi/tuotteet/100086329/sloggi-tai-basic-naisten-alushousut-3-pack-100086329,fi
placeholder,Hintansa arvoiset. Hyvän hintainen paketti laatuun nähden.,5,https://www.prisma.fi/tuotteet/100086329/sloggi-tai-basic-naisten-alushousut-3-pack-100086329,fi
placeholder,Yksi ihminen. Nämä alushousut ovat hyvät jalassa,5,https://www.prisma.fi/tuotteet/100086329/sloggi-tai-basic-naisten-alushousut-3-pack-100086329,fi
placeholder,Ok. Toimii loistavasti siinä mihin tarkoitettu,5,https://www.prisma.fi/tuotteet/100086329/sloggi-tai-basic-naisten-alushousut-3-pack-100086329,fi
placeholder,"Suosikkina Sloggi Tai. Vuosia olen käyttänyt Sloggi Tai alushousuja. Ratkaisevaa on materiaalina käytetty puuvilla, tosin alkuaikoihin verrattuna materiaali on ohentunut, joka vaikuttaa tuotteen kestävyyteen. Lisäksi malli on hyvä kun nousee sivulta ylemmäksi, eli ei hankaa nivusiin. Ehdoton alushousujen ykköstuote jatkossakin. Toivoisi tuotteesta myös tarjouksia!",5,https://www.prisma.fi/tuotteet/100086329/sloggi-tai-basic-naisten-alushousut-3-pack-100086329,fi
placeholder,"Hyvät alushousut. Kokemuksestani voin todeta, että alushousut ovat erittäin toimivat ja mukavat",5,https://www.prisma.fi/tuotteet/100086329/sloggi-tai-basic-naisten-alushousut-3-pack-100086329,fi
placeholder,Hyvät mutta edulliset. Hinta ja laatusuhde todella hyvä.,5,https://www.prisma.fi/tuotteet/100086329/sloggi-tai-basic-naisten-alushousut-3-pack-100086329,fi
placeholder,Todella hyvin istuu. Olen ollut tyytyväinen.,5,https://www.prisma.fi/tuotteet/100086329/sloggi-tai-basic-naisten-alushousut-3-pack-100086329,fi
placeholder,Hyvää en vaihda. Jo vuosia ollut luottopökät!,5,https://www.prisma.fi/tuotteet/100086329/sloggi-tai-basic-naisten-alushousut-3-pack-100086329,fi
placeholder,"Oikein hyvä pakki. Ostan tämän aina kun tarvitsen, oikein hyvä pakki.",4,https://www.prisma.fi/tuotteet/100086329/sloggi-tai-basic-naisten-alushousut-3-pack-100086329,fi
placeholder,Hyvä valinta! Tai-malliset mustat naisten pikkuhousut. Kolmen kappaleen pakettina. Aina varma valinta. Hyvät!,5,https://www.prisma.fi/tuotteet/100086329/sloggi-tai-basic-naisten-alushousut-3-pack-100086329,fi
placeholder,Parhaat pikkarit ikinä! Sloggeihin olen aina tyytyväinen! Istuvat hyvin ja ovat hyvälaatuiset ja kestävät käyttöä. Muita en vilkaisekaan.,5,https://www.prisma.fi/tuotteet/100086329/sloggi-tai-basic-naisten-alushousut-3-pack-100086329,fi
placeholder,Hyvä tuote. Kestävä hyvä perusalusvaate,5,https://www.prisma.fi/tuotteet/100086329/sloggi-tai-basic-naisten-alushousut-3-pack-100086329,fi
placeholder,Olen käyttänyt kymmeniä vuosia ja nytkin ostin tyt. Osyin tyttärelleni ja tyttärentytölle joululahjaksi. Käyttävät urheillessa.,4,https://www.prisma.fi/tuotteet/100086329/sloggi-tai-basic-naisten-alushousut-3-pack-100086329,fi
placeholder,Hyvä ostos. Mukavat yllä ja hyvin istuvat.,5,https://www.prisma.fi/tuotteet/100086329/sloggi-tai-basic-naisten-alushousut-3-pack-100086329,fi
placeholder,"Laatu. Hyvä laatu, mukavat käyttää, tykkään!",4,https://www.prisma.fi/tuotteet/100086329/sloggi-tai-basic-naisten-alushousut-3-pack-100086329,fi
placeholder,Minulle sopiva housumalli. Olen käyttänyt Sloggi-housuja n. 30 vuotta ja olen ollut tyytyväinen laatuun ja malliin. Minulla on yli 30 housua mustana ja valkoisena. Tuote on säilyttänyt kuosinsa lukuisienkin pesukertojen jälkeen.,4,https://www.prisma.fi/tuotteet/100086329/sloggi-tai-basic-naisten-alushousut-3-pack-100086329,fi
placeholder,Istuvat hyvin. Olen erittäin tyytyväinen,5,https://www.prisma.fi/tuotteet/100086329/sloggi-tai-basic-naisten-alushousut-3-pack-100086329,fi
placeholder,Pakkauksessa eri kokoja. Tyytyväinen muuten ja silleen,4,https://www.prisma.fi/tuotteet/100086329/sloggi-tai-basic-naisten-alushousut-3-pack-100086329,fi
placeholder,"Laatu hyvä. Kangas on pehmeää, muoto pysyy hyvänä pesun jälkeen. Edullinen paketti",4,https://www.prisma.fi/tuotteet/100086329/sloggi-tai-basic-naisten-alushousut-3-pack-100086329,fi
placeholder,"Napakka Sloggi. Ostin kolmen housun pakkauksen kerralla, koska tiedän, että tämä tuote on hyvä.",4,https://www.prisma.fi/tuotteet/100086329/sloggi-tai-basic-naisten-alushousut-3-pack-100086329,fi
placeholder,Sloggi. Tosi hyvät ja mukavat.,5,https://www.prisma.fi/tuotteet/100086329/sloggi-tai-basic-naisten-alushousut-3-pack-100086329,fi
placeholder,Sliggi tai. Kestävät ja hengittävät alushousut. Tai malliset antavat veren kiertää.,4,https://www.prisma.fi/tuotteet/100086329/sloggi-tai-basic-naisten-alushousut-3-pack-100086329,fi
placeholder,"Erittäin hyvät käytössä! Olen tyytyväinen ostokseeni.Tosi mukavat käytössä,ei kiristä mistään.Voin suositella!",4,https://www.prisma.fi/tuotteet/100086329/sloggi-tai-basic-naisten-alushousut-3-pack-100086329,fi
placeholder,"Mukavat menossa! Sloggin alushousuihin voi luottaa, ne ovat hyvin muotoillut ja hengittävää puuvillaa.",5,https://www.prisma.fi/tuotteet/100086329/sloggi-tai-basic-naisten-alushousut-3-pack-100086329,fi
placeholder,Luottopöksyt! Ostin taas kun entiset meni viimein rikki! Mahtava istuvuus!,4,https://www.prisma.fi/tuotteet/100086329/sloggi-tai-basic-naisten-alushousut-3-pack-100086329,fi
placeholder,Ainoat mitä ostan. En ole ainakaan 10 vuoteen käyttänyt muita alushousuja.,5,https://www.prisma.fi/tuotteet/100086329/sloggi-tai-basic-naisten-alushousut-3-pack-100086329,fi
placeholder,Kestävät mukavat alkkarit. Olen käyttänyt Sloggeja niin kauan kuin muistan.,5,https://www.prisma.fi/tuotteet/100086329/sloggi-tai-basic-naisten-alushousut-3-pack-100086329,fi
placeholder,Hyvältä näyttivät. Todella hyvännäköiset housut olivat vaimoni päällä.,4,https://www.prisma.fi/tuotteet/100086329/sloggi-tai-basic-naisten-alushousut-3-pack-100086329,fi
placeholder,"pehmeät, kestävät hyvin pesua. Minä ostan aina sloggeja",4,https://www.prisma.fi/tuotteet/100086329/sloggi-tai-basic-naisten-alushousut-3-pack-100086329,fi
placeholder,"Miellyttävät. Olen käyttänyt jo vuosia sloggy tuotteita. Ovat miellyttävät , kestävät ja hengittävät. Suosittelen :) !!",5,https://www.prisma.fi/tuotteet/100086329/sloggi-tai-basic-naisten-alushousut-3-pack-100086329,fi
placeholder,Hyvä istuvuus ja materiaali. Hyvä materiaali ja istuvuus,5,https://www.prisma.fi/tuotteet/100086329/sloggi-tai-basic-naisten-alushousut-3-pack-100086329,fi
placeholder,"Parhaat pikkarit ikinä. Olen käyttänyt Sloggeja jo vuosia. Paras istuvuus, mukavuus ja varmuus. Yhtä ihanat niin kesäkuumalla kuin talvellakin.",5,https://www.prisma.fi/tuotteet/100086329/sloggi-tai-basic-naisten-alushousut-3-pack-100086329,fi
placeholder,Todettua laatua. Pitkän käyttökokemuksen jälkeen olen tyytyväinen Tai-malliin ja kankaan lastuun.,5,https://www.prisma.fi/tuotteet/100086329/sloggi-tai-basic-naisten-alushousut-3-pack-100086329,fi
placeholder,"Sopii myös runsaalle pepulle. Sloggin Tai Basic on kuulunut alusvaatevalikoimaani jo vuosikausia. Pidän hengittävästä ja ihoystävällisestä puuvillasta ja inhoan pitsejä alusvaatteissa. Erityisen mukavaa on, että tai-leikkaus antaa tilaa myös leveälle lantiolle ja pyöreälle pepulle.",4,https://www.prisma.fi/tuotteet/100086329/sloggi-tai-basic-naisten-alushousut-3-pack-100086329,fi
placeholder,Aina luotettava ostos! Vuodesta toiseen Sloggit varma ostos!,5,https://www.prisma.fi/tuotteet/100086329/sloggi-tai-basic-naisten-alushousut-3-pack-100086329,fi
placeholder,"Hyvin istuvat. Ovat olleet mukavat, pehmeää kangasta. Suosittelen.",4,https://www.prisma.fi/tuotteet/100086329/sloggi-tai-basic-naisten-alushousut-3-pack-100086329,fi
placeholder,"Laadukkaat alushousut. Hyvin istuvat ja mukavan tuntuiset alushousut. Useamman kerran pesty, kestävät hyvin pesua.",5,https://www.prisma.fi/tuotteet/100086329/sloggi-tai-basic-naisten-alushousut-3-pack-100086329,fi
placeholder,"Laatu on todella HUONO. Heti uutena purkantuu ompeleet,ekan pesun jälkeen housuista lähtee kuminauhat irti ! ,kangas on todella ohutta.",1,https://www.prisma.fi/tuotteet/100086329/sloggi-tai-basic-naisten-alushousut-3-pack-100086329,fi
placeholder,Luotettava laatu! Tuote vastasi edelleen odotuksiani ja laatu on pysynyt tuotteessa hyvänä.,5,https://www.prisma.fi/tuotteet/100086329/sloggi-tai-basic-naisten-alushousut-3-pack-100086329,fi
placeholder,Hyvät alushousut. Olen tyytyväinen tuotteeseen.,5,https://www.prisma.fi/tuotteet/100086329/sloggi-tai-basic-naisten-alushousut-3-pack-100086329,fi
placeholder,Joustavat. Parhaat ja laadukkaimmat hintaansa nähden,5,https://www.prisma.fi/tuotteet/100086329/sloggi-tai-basic-naisten-alushousut-3-pack-100086329,fi
placeholder,"Sloggi Tai Basic. Olen vuosikaudet ostanut näitä housuja, mitkään muut eivät kelpaa!",5,https://www.prisma.fi/tuotteet/100086329/sloggi-tai-basic-naisten-alushousut-3-pack-100086329,fi
placeholder,Hyvä tuote. Aina luotettava merkki!,5,https://www.prisma.fi/tuotteet/100086329/sloggi-tai-basic-naisten-alushousut-3-pack-100086329,fi
placeholder,"Sloggi tai. Ostin taas tai mallisia alushiusuja, ne ovat mukavia kun paksureisisenäkin voi käyttää, housut eivät purista taipeista.",4,https://www.prisma.fi/tuotteet/100086329/sloggi-tai-basic-naisten-alushousut-3-pack-100086329,fi
placeholder,"Vuosikaudet käyttänyt näitä sloggeja. Muuten tyytyväinen mutta laatu on heikentynyt näissä, tulen jatkossakin ostamaan mutta voisi kiinnittää huomiota saumojen laatuun",3,https://www.prisma.fi/tuotteet/100086329/sloggi-tai-basic-naisten-alushousut-3-pack-100086329,fi
placeholder,Mukavat käyttää. Olen käyttänyt kyseisiä alushousuja useita vuosia. Mukavat pitää päällä.,4,https://www.prisma.fi/tuotteet/100086329/sloggi-tai-basic-naisten-alushousut-3-pack-100086329,fi
placeholder,Hinta/laatu hyvä. Hyvät jo kymmeniä vuosia käyttänyt.,4,https://www.prisma.fi/tuotteet/100086329/sloggi-tai-basic-naisten-alushousut-3-pack-100086329,fi
placeholder,"Sloggit. Malli jää ja kuulukin jäädä vyötärön alle, mutta kuminauha on hämmästyttävän kireä. En ole huomannut tätä muun merkkisissä pikkareissa.",3,https://www.prisma.fi/tuotteet/100086329/sloggi-tai-basic-naisten-alushousut-3-pack-100086329,fi
placeholder,"Paras puuvillainen. Paras puuvillainen naisten alushousu. Kestävä, joustava ja istu hyvin.",5,https://www.prisma.fi/tuotteet/100086329/sloggi-tai-basic-naisten-alushousut-3-pack-100086329,fi
placeholder,Hinta/laatusuhde kohdillaan. Vuosikymmenien ajan käyttänyt Sloggi Tai Basic alushousuja,5,https://www.prisma.fi/tuotteet/100086329/sloggi-tai-basic-naisten-alushousut-3-pack-100086329,fi
placeholder,Hyvän tuntoiset. Hyvän tuntoiset ja miellyttvät Päällä,4,https://www.prisma.fi/tuotteet/100086329/sloggi-tai-basic-naisten-alushousut-3-pack-100086329,fi
placeholder,Miellytvä pitää. 3 viikkoa sitten osti ja oon ollut tyytyväinen,4,https://www.prisma.fi/tuotteet/100086329/sloggi-tai-basic-naisten-alushousut-3-pack-100086329,fi
placeholder,Todalla hyvät ja kestävät. Ostin äskettäin hml prismasta,5,https://www.prisma.fi/tuotteet/100086329/sloggi-tai-basic-naisten-alushousut-3-pack-100086329,fi
placeholder,Voi pestä kunnolla 60 asteisessa vedessä. Olen vuosia käyttänyt juuri näitä Sloggy Tai Basic -alushousuja,5,https://www.prisma.fi/tuotteet/100086329/sloggi-tai-basic-naisten-alushousut-3-pack-100086329,fi
placeholder,Hyvä tuote. Hyvä tuote olen tyytyväinen,5,https://www.prisma.fi/tuotteet/100086329/sloggi-tai-basic-naisten-alushousut-3-pack-100086329,fi
placeholder,"Sopivat käyttöön. Hyvän korkea lahkeen suuaukko, pysyy kuosissa pitkään, ei ota helposti väriä pyykissä, pysyy valkoisena. Kuulunut käyttööni pitkään",5,https://www.prisma.fi/tuotteet/100086329/sloggi-tai-basic-naisten-alushousut-3-pack-100086329,fi
placeholder,"Paras istuvuus. Ainoat alushousut, joita käytän mahtavan istuvuuden takia.",5,https://www.prisma.fi/tuotteet/100086329/sloggi-tai-basic-naisten-alushousut-3-pack-100086329,fi
placeholder,3kpl pakkaus. Ostin 3 kpl pakkauksen. Olisipa näitä vielä kokoa 50.,5,https://www.prisma.fi/tuotteet/100086329/sloggi-tai-basic-naisten-alushousut-3-pack-100086329,fi
placeholder,Parhaat alushousut. Parhaat alushousut. Istuvuus täydellinen. Ei tipu eikä kiristä.,5,https://www.prisma.fi/tuotteet/100086329/sloggi-tai-basic-naisten-alushousut-3-pack-100086329,fi
placeholder,"Täydelliset ""alkkari"". Olen käyttänyt Sloggin TAI mallisia pöksyjä jo vuosia, ehkäpä vuosikymmeniä, ainakin niin kauan kun tai mallia on valmistettu. laatu on miellyttävä, mutta tärkeintä on korkea malli ""lahkeessa"" ei kiristä nivusia.",5,https://www.prisma.fi/tuotteet/100086329/sloggi-tai-basic-naisten-alushousut-3-pack-100086329,fi
placeholder,"Luotettua laatua! Voisin sanoa, että vuosikymmenien ajan olen ostanut vain Sloggi-alushousuja. Kestää käyttämistä ja pesemistä ja on miellyttävää materiaalia.",4,https://www.prisma.fi/tuotteet/100086329/sloggi-tai-basic-naisten-alushousut-3-pack-100086329,fi
placeholder,Mahtavat alkkarit. Hyvin istuvat ja kestävät. Pierut pääsee ulos,5,https://www.prisma.fi/tuotteet/100086329/sloggi-tai-basic-naisten-alushousut-3-pack-100086329,fi
placeholder,Koetellut ja kestävät. Kyllä puoliso on ollut kovin tyytyväinen.,4,https://www.prisma.fi/tuotteet/100086329/sloggi-tai-basic-naisten-alushousut-3-pack-100086329,fi
placeholder,"Monivuotiset suosikkini. Kevyet,hyvät ja huomaamattomat. Edulliset kolmen housut pakkaukset.",5,https://www.prisma.fi/tuotteet/100086329/sloggi-tai-basic-naisten-alushousut-3-pack-100086329,fi
placeholder,"Sloggi 3 pakkaus. Ostin n. kuukausi sitten ja en ole kovin tyytyväinen, koska yhdet alkkarit jo purkautuivat saumasta. Kangas periaatteessa mukavantuntuinen päällä, malli ei ihan paras mahdollinen vaikka näyttää hyvältä.",2,https://www.prisma.fi/tuotteet/100086329/sloggi-tai-basic-naisten-alushousut-3-pack-100086329,fi
placeholder,Mukavat päällä. Sloggin housut ovat aina olleet kestäviä ja mukavat päällä,4,https://www.prisma.fi/tuotteet/100086329/sloggi-tai-basic-naisten-alushousut-3-pack-100086329,fi
placeholder,Maailman parhaat alushousut. Muita en käytä kuin Sloggi Tai-malleja,5,https://www.prisma.fi/tuotteet/100086329/sloggi-tai-basic-naisten-alushousut-3-pack-100086329,fi
placeholder,"Loistava valinta jo vuosia. Olen ostanut näitä alushousuja jo vuosia ja ollut tyytyväinen, ehkä kangaslaatu on hiukan ohentunut.",5,https://www.prisma.fi/tuotteet/100086329/sloggi-tai-basic-naisten-alushousut-3-pack-100086329,fi
placeholder,Todella hyvä tuote. Olen ollut tuotteeseen erittäin tyytyväinen.,5,https://www.prisma.fi/tuotteet/100086329/sloggi-tai-basic-naisten-alushousut-3-pack-100086329,fi
placeholder,"Erinomaiset böksyt. Olen 10:niä vuosia käyttänyt Sloggeja ja en tule vaihtamaan muihin böksyihin.Arvostan Tai mallin istuvuutta ja laatu on todella hyvä.Voin käyttää eri asujen kanssa ja oloni on huojentunut,Olen jälleen tyytyväinen viimeksi ostamiini Tai malliin.",5,https://www.prisma.fi/tuotteet/100086329/sloggi-tai-basic-naisten-alushousut-3-pack-100086329,fi
placeholder,Hyvä peruspikkuhousu. Laadukas ja hyvin useita pesuja kestävä peruspikkuhousu.,4,https://www.prisma.fi/tuotteet/100086329/sloggi-tai-basic-naisten-alushousut-3-pack-100086329,fi
placeholder,"Pitää muotonsa,kestää pesua,pitää värinsä. Arkikäyttöön todella terveelliset,hengittävät ja muotonsa säilyttävät alushousut",4,https://www.prisma.fi/tuotteet/100086329/sloggi-tai-basic-naisten-alushousut-3-pack-100086329,fi
placeholder,Sloggi alushousumerkki on paras. Olen käyttänyt Sloggi alushousumerkkiä monet vuodet.On kestävä ja säilyttää värin hyvin.,5,https://www.prisma.fi/tuotteet/100086329/sloggi-tai-basic-naisten-alushousut-3-pack-100086329,fi
placeholder,Hyvät mutta ostin M liian pienet. Pienet yleensä M sopiva,5,https://www.prisma.fi/tuotteet/100086329/sloggi-tai-basic-naisten-alushousut-3-pack-100086329,fi
placeholder,"Erittäin hyvät alushousut. Olen erittäin tyytyväinen ostokseen, hinta-laatusuhde erittäin hyvät. Housut eivät kutistu pesussa ja ovat miellyttävät käyttää.",5,https://www.prisma.fi/tuotteet/100086329/sloggi-tai-basic-naisten-alushousut-3-pack-100086329,fi
placeholder,Mukavat. Sopivat hyvin arkikäyttöön.,5,https://www.prisma.fi/tuotteet/100086329/sloggi-tai-basic-naisten-alushousut-3-pack-100086329,fi
placeholder,"Hyvää materiaalia. Ostin tuotteen muutama viikko sitten. Olen ollut laatuun tyytyväinen. Kaupassa en osannut arvioida ""lahkeen""suuruutta. Mielestäni se on liian iso, mutta tulen sen kassa toimeen.",4,https://www.prisma.fi/tuotteet/100086329/sloggi-tai-basic-naisten-alushousut-3-pack-100086329,fi
placeholder,Hyväksi havaittu. Olen ollut ostokseeni tyytyväinen,5,https://www.prisma.fi/tuotteet/100086329/sloggi-tai-basic-naisten-alushousut-3-pack-100086329,fi
placeholder,Tosi hyvä. Olen ostanut näitä jo monta vuotta ja tosi hyviä,5,https://www.prisma.fi/tuotteet/100086329/sloggi-tai-basic-naisten-alushousut-3-pack-100086329,fi
placeholder,"Harhaanjohtava koko merkintä. Ostin nornaalikokoani yhden koon suuremmat, mutta nekin tuntuvat tiukalta päällä.",3,https://www.prisma.fi/tuotteet/100086329/sloggi-tai-basic-naisten-alushousut-3-pack-100086329,fi
placeholder,Hyvät on. Hyvin istuu päälle..,4,https://www.prisma.fi/tuotteet/100086329/sloggi-tai-basic-naisten-alushousut-3-pack-100086329,fi
placeholder,Mukavat käyttää. Olen jo pitkään käyttänyt Sloggi alushousuja. Ne ovat miellyttää materiaalia ja tuntuvat iholla hyviltä.,5,https://www.prisma.fi/tuotteet/100086329/sloggi-tai-basic-naisten-alushousut-3-pack-100086329,fi
placeholder,Ihan parhaat. Olen käyttänyt Sloggi Tai-mallin alushousuja vuosikausia enkä oikeastaan muita enää edes käytä. Tämä malli sopii itselleni erinomaisesti.,5,https://www.prisma.fi/tuotteet/100086329/sloggi-tai-basic-naisten-alushousut-3-pack-100086329,fi
placeholder,Luottotuote. Vaatekaapin laadukasta perusvaatetta sopivaan hintaan. Luottotuote.,4,https://www.prisma.fi/tuotteet/100086329/sloggi-tai-basic-naisten-alushousut-3-pack-100086329,fi
placeholder,"Parhaat alkkarit. Olen käyttänyt sloggeja monta vuotta, enkä aio niistä luopua. Pysyvät hyvin ""kuosissa"", miellyttävät päällä.",5,https://www.prisma.fi/tuotteet/100086329/sloggi-tai-basic-naisten-alushousut-3-pack-100086329,fi
placeholder,Perus sloggi. Miellyttävät alushousut. Hyvä hinta/laatu suhde,5,https://www.prisma.fi/tuotteet/100086329/sloggi-tai-basic-naisten-alushousut-3-pack-100086329,fi
placeholder,Takuuvarma hinta/laatu-suhde. Olen käyttänyt Sloggi-alushousuja vuosikausia ja tämä on ehdottomasti paras malli.,5,https://www.prisma.fi/tuotteet/100086329/sloggi-tai-basic-naisten-alushousut-3-pack-100086329,fi
placeholder,Istuu hyvin. Olen vuosia käytänyt ja ollut tosi tyytyväinen . Ainut negatiivinen asia on että vyötärönauha/sloggi lappu lähtee herkästi purkaantumaan.,4,https://www.prisma.fi/tuotteet/100086329/sloggi-tai-basic-naisten-alushousut-3-pack-100086329,fi
placeholder,"Luotettavat ominaisuudet. Pysyvät hyvin muodossa, mukavat, huomaamattomat",4,https://www.prisma.fi/tuotteet/100086329/sloggi-tai-basic-naisten-alushousut-3-pack-100086329,fi
placeholder,Toimii. Hyvät ja mukavat käytössä . Suosittelen!,4,https://www.prisma.fi/tuotteet/100086329/sloggi-tai-basic-naisten-alushousut-3-pack-100086329,fi
placeholder,"Pikkuhousut istuvat hyvin. Sloggin Tai pikkuhousut istuvat hyvin ja lahkeen reikä riittää vähän paksummallekin reidelle, niin että housu ei hierrä nivuksiin",4,https://www.prisma.fi/tuotteet/100086329/sloggi-tai-basic-naisten-alushousut-3-pack-100086329,fi
